Input_id,labeldem,labelgop,labeldjt,id,body,created_utc,link_id,author_flair_text
doqpgxr,0,-1,-1,doqpgxr,I still don’t understand the military people who side with trump.  He shits on service and sacrifice. Absolutely dodged the draft. Will get many killed needlessly. Uses them as a patriotic flag waiving exercise.  They are voting against their self interest with their lives on the line.,1508711110,t3_783dha,
dqq7bca,-1,0,0,dqq7bca,The typical democrat voter makes waaaaaaaaaaaaaay under $30k a year...but after all their govt. assistance they are able to break that barrier.,1512349570,t3_7hcxgx,
dfh2c4n,-1,0,0,dfh2c4n,"It has nothing to do with Judge Gorsuch, but everything to do with the fact that the alt left hates President Trump so much (because their candidate didn't get elected).  They want to block everything that Trump does just to keep him from doing anything.  All because of jealousy.",1490632980,t3_61t8pm,
dhvh9ee,-1,0,0,dhvh9ee,"They're both obviously far from healthy. Hillary dropping like a sack of potatoes from \"pneumonia\" was such obvious bullshit and they were totally dressing her to hide a colostomy bag. I'm not sure what's really wrong with her, but I'd love to know.",1495426667,t3_6ckpgf,
djj4gjo,0,0,-1,djj4gjo,"For those not keeping score, Rogers recently testified that Trump didn't \"pressure\" him into encouraging Comey to drop the Flynn investigation -- however, he refused to answer whether Trump \"asked\" him to.

That said, my gut is that Rogers is trying to do the right thing.",1498686980,t3_6k3x95,
dpa9kn2,0,-1,-1,dpa9kn2,"&gt;Pocahontas just stated that the Democrats, lead by the legendary Crooked Hillary Clinton, rigged the Primaries! Lets go FBI &amp; Justice Dept.

This would be the scandal of the presidency if this were Obama, and yet this may not even be the biggest scandal of the day. Something huge is going to happen today. This twitter meltdown is especially juicy.",1509711548,t3_7aiyyp,
dpb93vg,0,0,-1,dpb93vg,"&gt;Papadopoulos’ public role for the Trump campaign continued. In late September, just six weeks before Election Day, **he gave an interview as a Trump campaign official to the Russian Interfax News Agency**, where he said that Trump will “restore the trust” between the U.S. and Russia.

For fucks sake.",1509749840,t3_7amzzm,
dqmkfho,-1,1,1,dqmkfho,"Because Obama had just expelled all Russian diplomats and nearly started world war 3? Where's the crime? NOWHERE. 


Edit: Lol 15 downvotes instantly. Come at me snowflakes! You can break my account but you'll never break Trump. 2 terms. 2 genders.


Edit: Replies en masse are pointless since liberals subs block dissenters to 10 min reply intervals. Give up on Russia and find out how to fix your broken party.",1512160917,t3_7gw8r2,
dudx5c5,-1,0,0,dudx5c5,"13 people from russia didn't like Hillary Clinton, I don't like corrupt career politicians either, neither do many others in countries all around the world. This was enough to bring down a billion dollar campaign from \"the most experienced person\" for the job? do you know how ridiculous all these claims are?

And entire superpower country, brought to it's knees by online comments",1518869506,t3_7y697l,
dumak09,-1,0,0,dumak09,"If it means the difference between a liberal and GOP victory in November, we may need to.  Preventing Democrats from winning is a necessity.",1519249409,t3_7z992y,
d9g6qr9,-1,0,0,d9g6qr9,**RUSSIA! RUSSIA!!! RUSSIA!!!!!**  That will go down as the last desperate gasp of the Clinton machine.  The DNC should have known the Clintons' corruption would be such an albatross.,1477960721,t3_5ag352,
db0blev,-1,0,0,db0blev,"I love how WaPo (150+ years, 47 Pulitzers, Watergate) and NYT (150+ years, 117 Pulitzers) are called \"fake news\" by people who believe that Hillary Clinton sold child sex slaves out of a pizza restaurant.",1481336476,t3_5hhji4,
dd5acrp,0,-1,-1,dd5acrp,"I keep seeing people calling Bannon \"Wormtongue\" and I think it should be made clear:  King Theoden was actually a good man who was under a spell.   Donald Trump is no King Theoden.",1485877131,t3_5r8puh,
der71jj,0,0,-1,der71jj,"&gt; It’s also curious that Trump is now embracing jobs reports, after repeatedly dismissing them last year as fake.

Trump is already completely unreliable in my mind.  When polls/statistics are not good for him they're, 'fake news.'  Then when they conform to his view on the world they are the best thing since sliced bread.  The man in living in his own reality.",1489158893,t3_5ymjv3,California
df38c6t,-1,0,1,df38c6t,They were all good spirit imitations hard to compare really with Trump we know there is real political will to damage him behind it. Hillary is always treated with kiddy gloves.,1489839627,t3_603rpy,Foreign
dgoe6g6,0,0,-1,dgoe6g6,"&gt; Several hours after the attacks on 11 September 2001, during which almost 3,000 people died, Mr Trump was interviewed on radio and claimed that since the Towers came down, he now owned the tallest building in Manhattan. He was also condemned for claiming around $150,000 of government funds for small businesses to get back on their feet after the attacks.

And now, he's President.",1493028616,t3_677xik,Foreign
dhzlxqc,0,-1,-1,dhzlxqc,"&gt; “Keep up [the] good work, you are doing an amazing job,” Trump told Duterte during the call.

The US president is actively encouraging a mass-murderer to keep going.",1495649437,t3_6d3op0,
dj2bmi8,0,-1,-1,dj2bmi8,"Higher approval rating than Obama!  
More popular votes than Clinton!  
Healthiest president ever!   
Biggest hands!  
  
Trump is just an insecure teenager in a gross old man suit.",1497791929,t3_6hzkup,
dj78m3y,0,-1,0,dj78m3y,"Its been many years since the NRA was an organization that cared about firearms safety and training.  They are now nothing more than a lobbying arm of the Republican party, concerned only with lining their pockets.",1498054650,t3_6im29w,
dofucs0,0,0,-1,dofucs0,"&gt;Even the social conservative Trump mocks Pence's old-school ways, according to Mayer. When visitors come to see Trump after meeting Pence, the president will ask, **\"Did Mike make you pray?\"**

Holy shit!!!",1508157159,t3_76q24k,America
drbjgm4,-1,1,1,drbjgm4,"This narrative has been around forever.  Trump has been about ready to fire Mueller for about a year , but yet it has not happened. There is nothing there so he won't fire him.  A year plus and here we still are.

Edit.  Yep snowflakes down voting with a fury.",1513393787,t3_7k49ik,
dsdvs3a,0,0,-1,dsdvs3a,"Bullshit.

No one is concerned if Trump has diabetes or sleep apnea.  I wouldn't be surprised if he has either but those don't affect his ability to run the country.

What *does* affect his ability to run the country is his family history of dementia, and his public displays of instability.  

Jesus Christ, why are we having this conversation?


Edit:  Today I learned about the dangers of sleep apnea, yikes.",1515447770,t3_7p1z8x,
dujxzr6,-99,-1,-99,dujxzr6,"After a teacher is wrestled out of their weapon and kills students, the GOP will be like \"well every kid in school should have a weapon!\"",1519150740,t3_7yy2mb,America
dafx5n0,-1,1,1,dafx5n0,"Yep, For real. Can't wait to see Trumps lead increase from this. She stole way to many votes from him. I'm surprised he even won seeing as how the majority of the machines where soros.",1480133739,t3_5exjrw,
ddizw1y,0,-1,-1,ddizw1y,"Isn't he making money by renting out space in Trump Tower to the Secret Service and soon the Defense Dept?

Isn't he making money by foreign dignitaries staying in his Washington, D.C. hotel in order to try and gain favor from him?",1486641941,t3_5szjam,
dg1kg3i,-1,0,0,dg1kg3i,Not as bad as Hillary is leaking into her adult diaper because she's an old crone who fell like a side of beef during the campaign.,1491765729,t3_64em95,
dnq561p,-1,1,1,dnq561p,Ironically enough he's actually doing that on Tuesday. But this is just another shameless smear campaign and a new low for the left. The local government and infrastructure of Puerto Rico is the reason we can't get them resources any faster. Their governor has done nothing but praise Trump through all this.,1506797679,t3_73fbka,
dp3j2ym,-1,1,1,dp3j2ym,"Manafort and Gates problems had nothing to do with Trump campaign.

Popodopoulus is very small fry and didn't do anything with Russia or with the Trump campaign.

How long do you think Mueller will stay on this witch hunt?
Years?

I guess he can.  He will just be a wart on 
Trump. Stay classy dems.",1509378202,t3_79o0zu,
dqm6ftu,1,0,0,dqm6ftu,"Yeah the \"Former Obama Official\" that Obama fired and then warned Trump about. The same official that Sally Yates also warned the trump admin about right?

The same official that Trump said \"was a good guy\" several times. 

**EDIT:** HAHAHAHA. Today:
&gt;The President \"feels sorry for Flynn... I think he likes Flynn,\" this official said, adding the Trump is \"thinking about Flynn and his family.\"",1512147631,t3_7gw8r2,
dr65y79,1,-1,-1,dr65y79,"The Democrats achieved the impossible. They won a Senate Seat in ALABAMA. 2018 is next, and they have a chance. Democrats have a chance in every single state where there is an election. 

Donald Trump went all out supporting Moore. This is absolutely and devastatingly embarrassing for Trump's White House, and we have now entered a turning point in the country.",1513135814,t3_7jgexr,
drp5p09,0,-1,-1,drp5p09,"While most Americans have to work over this holiday, Trump is in his gold palace fantasy land rubbing his wealth in our faces.  Real man of the people, this guy.",1514120059,t3_7luyv2,
dtfje1m,-1,0,1,dtfje1m,Lol he wrote it all of a sudden? It’s always a different story from you liberals...first TRUMP WILL CRASH THE STOCK MARKET...(goes to all time high) HE HAS NOTHING TO DO WITH IT AAAAAHHHHH why can’t you libs be happy the Market is great and the economy is kicking ass again,1517260789,t3_7tu63m,
dtmdv6t,0,0,-1,dtmdv6t,"Attacking your own FBI and Justice departments, after you picked the heads of both departments.  This is how you know Trump is 100% guilty.",1517573242,t3_7uqsof,
dtn0x3z,-1,-99,1,dtn0x3z,"Steele was a rabid anti Trump guy who created a fictional document paid by the DNC and anti trump republicans. It was known to be bullshit and yet still used to justify investigations.

Clean house. Get the corruption out, FBI has major egg on face, same with DOJ and the Obama admin. Scandal free my ass.",1517598207,t3_7usv0k,
du0bhoz,-1,1,1,du0bhoz,"This is the dumbest comment so far. Carry on with your fan fiction reality. Trump is doing fine, but keep on screaming.",1518215915,t3_7wh0lz,
dc71i5m,0,-1,-1,dc71i5m,"Anyone noticed how he rarely or never shoots back at Pelosi, Schumer, Sanders or other Democratic politicans but as soon as a celebrity dares to criticize him he is all over twitter.",1483966210,t3_5mx8w0,
deeytkp,-1,0,0,deeytkp,"What a fucking joke.  Where was the ACLU when Bill Clinton and then AG Lynch were caught secretly meeting on Lynch's jet on the Phoenix airport tarmac during an ongoing investigation into Hillary's misuse of classified documents and a week before Lynch refused to prosecute?

More evidence that the ACLU is nothing more than a tool of the left wing.",1488468431,t3_5x3pim,
df6fzup,-1,0,0,df6fzup,So if I said 1950s democrats who embraced the Jim Crow era south were literally racist for something they did in the past the affiliations they held many decades ago still apply? You are really reaching for something that's not there,1490029199,t3_60h33a,
dgie2jw,0,0,-1,dgie2jw,"Keep in mind this is a *Republican* president with majorities in both the House and the Senate threatening the minority party to fall in line because his leadership is too poor to unify his own party.  And how does he threaten them?  By saying he will take away health care benefits for 7 million of the least empowered people in the country.  

What garbage this man is.",1492687843,t3_66gyvo,Indiana
dk5jc6n,-1,0,1,dk5jc6n,"The scandal has already been totally flipped on the Obama administration who gave this known Kremlin operative special permission to enter the
US and meet with dozens of government officials. Trump Jr was a private citizen with no knowledge of who this person was. It's on Obama admin for granting special entry and not keeping tabs.  The conspiracy minded might be starting to think it almost looks like a set up.",1499920399,t3_6mzafa,
dlo7q0l,0,-1,-1,dlo7q0l,"Trump, after many months, came out from the shadows today to hold a press conference wherein he fought tooth-and-nail to equate the actions of literal murderous white supremacists to those protesting the white supremacists. 

Let that sink in.",1502831647,t3_6tx8h7,California
dqqsvnd,0,0,-1,dqqsvnd,"That's a constitutional crisis of a theory. 

&gt;Why it matters: Trump's legal team is clearly setting the stage to say the president cannot be charged with any of the core crimes discussed in the Russia probe: collusion and obstruction. **Presumably, you wouldn't preemptively make these arguments unless you felt there was a chance charges are coming.**",1512385262,t3_7hgmrm,
dtbib6v,0,0,-1,dtbib6v,"It's been what, 4 days, since Trump said he looked forward to talking with Mueller and would absolutely talk to him under oath. Things change quickly",1517060537,t3_7tcm5p,
dtl3x1z,-1,0,0,dtl3x1z,"Okay, so I have to bash Republicans when they do something wrong but I shouldn't attack Democrats for the same thing? Seems weird",1517512466,t3_7ul0m8,
dbckqc4,0,0,-1,dbckqc4,"DAE think it's weird that the only pro-Russia person in the entire Republican party won the presidency, and then his campaign chair and pick for Secretary of State have these vague connections to Russia like being awarded the highest Russian honor by Putin, having $200 million oil deals, and secret off-book payments/shell corporations directly involved with Russia?",1482085779,t3_5j1g7x,California
dcljwao,-1,0,0,dcljwao,"It degrades the premise you've invented to use that quote to begin with.

Teddy was about as far removed from what you liberals believe and act like as one can be.  A primary difference between you is that he actually loved this country and backed it up with action.",1484771339,t3_5or1iy,
ddwtfpn,0,0,-1,ddwtfpn,"&gt; The Post also revealed it cost $88,320 to put secret service agents up in a hotel while son Eric Trump visited Uruguay to promote a Trump-brand condo tower.

Greasy.",1487444884,t3_5utxug,
dezh8vp,-1,0,0,dezh8vp,"Maybe he was stunned because he found out that the Obama administration was collecting on an opposing candidate.

&gt;Nunes came out of that briefing appearing likewise  and saying it was “very possible” information involving Trump himself had been collected as part of the incidental intelligence gathered when the U.S. intelligence community was monitoring Russian officials

Heads may roll, but they may not be who's you think it is!",1489624980,t3_5zna6c,
df55j47,0,0,-1,df55j47,"37 percent, ouch.  

For points of comparison Obama was at 62 percent at this time in his presidency, George W. Bush was at 53 percent.",1489955873,t3_60c82m,
dh5utuo,0,-1,0,dh5utuo,"They get away with inhumanity with surprising regularity, why would this be any different? 

This is the GOP's big FU to the black guy in the White House. It's not about health care, it's about spite.",1493985763,t3_69e8hm,
djpzy7b,-1,0,0,djpzy7b,Soooooo.....what you are saying is that they told the truth about Hillary Clinfon before she smashed the glass basement? You've spez'd yourself.,1499088395,t3_6kza3z,
dkvbf3f,0,-1,-1,dkvbf3f,"To be fair Trump tried to swat the fly,  but gave up after it kept high-fiving his tiny hand.",1501292550,t3_6q87t9,
dpt6ubr,0,-1,0,dpt6ubr,"Cliff notes for this hearing:

*Republican* asks a softball question and/or crazed conspiracy theory involving Hillary Clinton, Obama, and three naked wombats.

Sessions answers questions in a lucid manner with a shit eating grin on his face.

*Democrat* asks question regarding Russia probe.

Sessions experiences confusion and suffers immediate explosive amnesia.",1510677107,t3_7cw5bo,
drelu05,-1,0,0,drelu05,"Dems have yet to condemn Bill Clinton. They too have no shame. 

Edit: Haha wow a lot of unemployed libs over here. Just a heads up, I work on Wall Street so I probably know a little bit more about the economy than you do. 

Lol who here knows what the Army Reserve is?

Omg and apparently there are folks out there who don't benefit from higher equity prices lmao",1513565488,t3_7kh5hc,
dsindxj,-1,0,0,dsindxj,"They didn't do it to Bernie. They let him, a non-Democrat, run.


This was an enormous mistake. Don't give non-Democrats a national platform to tear down actual Democratic candidates. Sanders is a useless, selfish politician who thinks the key to politics in the modern age is to abandon civil rights to attract votes from racist white working class voters who hate black people. He's garbage.",1515677477,t3_7pmytd,
dsyfvk1,0,-1,-1,dsyfvk1,"You control ALL three branches and you still can't keep the lights on?

Did Obama winning in 08 really break the GOP that much?",1516424999,t3_7roei1,
dtgdemz,-1,1,1,dtgdemz,"Ya. Well. They are pretty much our ally against ISIS and the globalists. And the Russian hack narrative is a complete red herring bullshit story that literally no one cares about who isn't already predisposed to hate Trump for any reason anyone gives them.

So this is probably a good thing. MAGA!",1517296056,t3_7ty9ot,
duxzpsz,1,-1,-1,duxzpsz,"This piece of fucking shit can fuck off. Comey is a *huge* reason why we have Cadet Bone Spurs as President. If he hadn't tanked Hillary's campaign at the 11th hour for no reason, we'd be making progress in this country.",1519789908,t3_80t036,
dbc8k9j,0,-1,0,dbc8k9j,"&gt;Among Republicans without any college education, the share was even larger: 60 percent, compared with 37 percent of Republicans with a college degree.

This is fucking embarrassing for college educated Republicans.",1482063284,t3_5izufl,
de472h4,0,-1,0,de472h4,What's even better is when Republicans act as if they would have *never* done something like this. They obviously forgot about the Koch funded Tea Party that blocked Obama any chance they got for years. The hypocrisy is unreal.,1487868066,t3_5vr45z,America
deaofx8,0,-1,-1,deaofx8,These people who support Trump always seem shocked when when it's *their* neighbors getting screwed over by exactly what they voted for.,1488235938,t3_5wk27l,Colorado
dfjezpu,-1,1,1,dfjezpu,"So after two months of Democrats leaking (sans sources) info on Flynn, Trump's EOs and Trump's calls to foreign leaders, the left is now angry that the RNC is playing their game?

¿Comp sè dicè \"hypocrisy\"?",1490748598,t3_6237vv,
dfnezbp,0,-1,0,dfnezbp,"GOP logic.

Offering the workers money directly is Socialism at it's worst, giving ten times as much to subsidize the owners is capitalism at it's best!",1490969410,t3_62ldh8,
dfxfag8,0,-1,-1,dfxfag8,"&gt;The officials said Mr. Brennan also indicated that unnamed advisers to Mr. Trump might be working with the Russians to interfere in the election. 

Hey, that seems like a problem for them.",1491514637,t3_63vx43,
dh2jh43,0,0,-1,dh2jh43,"He thought the presidency WAS authoritarian.  This is why everything was Obama's fault.  He had no concept of how it actually worked and he assumed Obama was simply being a poor dictator.  He'd do much better, of course.  If it wasn't for that damn archaic congress... I bet Obama never had to deal with these democrats!",1493810595,t3_68zhy0,
di8v4vz,0,0,1,di8v4vz,"We prove that WaPo is fake like every day. This only means anything to you because Fox News getting called on it fits your narrative. News flash, trump supporters don't really like Fox News either. All MSM is fake bs lately.",1496182276,t3_6eagay,
dicvsg8,0,-1,-1,dicvsg8,"&gt;The declaration amounts to a new level of partisanship in Washington, where the president and his administration already feels besieged by media reports and attacks from Democrats. The idea, Republicans said, is to choke off the Democratic congressional minorities from gaining new information that could be used to attack the president.

Let's remember this the next time Democrats bend over backwards to be bipartisan. It's a one-way street and it leads to hell.",1496398355,t3_6etetu,
dimupet,-1,0,0,dimupet,Hahahahahaha. So nothing came from this at all! Except Bill Clinton illeglay met with Lynch and Comey leaked info to a friend. Please can you libs stop with this Russia shit. It's not true ! If it was true then Obama would have found it when he Illegaly wire tapped Trump associates.,1496941199,t3_6g0srl,
dnek066,-1,0,0,dnek066,"Wait, so its okay for there to be some good people that immigrate here illegally but not okay for there to be some good people at a protest ?

Liberal slant much ? 

Edit : Not everyone in Charlottesville was either a Nazi or Antifa.",1506186650,t3_71zhgd,
dp39i7p,0,-1,-1,dp39i7p,Remember when Trump supporters were saying Hillary Clinton was the one who was going to get arrested this morning? Pepperidge Farm remembers.,1509365858,t3_79nagg,
dpuwqse,-1,0,0,dpuwqse,Cnn is fake news. I do not know how Acosta is still employed as he is nothing but an alt left propaganda machine and not a journalist. If I were trump I would ban him from the press briefings and bring in an actual journalist.,1510757536,t3_7d4bul,
droakk0,0,0,-1,droakk0,I think at this point I'd be surprised if Trump and his kids were engaged in any business that didn't have at least some level of corruption built in.,1514063646,t3_7lr29m,
dskq0zm,0,0,-1,dskq0zm,"&gt;What [Trump] usually does is he’ll call after a show and say, ‘I really enjoyed that,’” an unnamed former Fox anchor told Vanity Fair. “The highest compliment is, ‘I really learned something.’ Then you know he got a new policy idea.”

This is insane",1515772951,t3_7pxd0e,
dfihlj3,-1,0,0,dfihlj3,Only democrats believe that.  They blame everything on race so they won't have to take responsibility for their own failed policies.,1490710857,t3_61zkph,
dhdhrqr,0,-1,0,dhdhrqr,"It's just so frustrating to think that if this were Clinton, Obama or any other Democrat the GOP would have had 20 investigations, a special prosecutor and everything else available to look into this.",1494425150,t3_6acy7s,
dhlzcm5,0,-1,-1,dhlzcm5,"Keep in mind that the State department is still unstaffed.  So while Trump blunders and leaks info to Russia, we have less people to do damage control.

All because voters decided to treat the election like American fucking Idol.",1494899134,t3_6bek7n,
djnc5vn,-1,1,1,djnc5vn,"One of his tax return was already leaked before lmao and it showed that he paid a ton of money in taxes. 

Edit. Almost 100 downvotes.. please no more! 😫

Edit: ok I've seen the light, your downvotes have shown me the error of my ways.  I am now 100% liberal.",1498921420,t3_6kn1qz,
dmfwv3y,0,0,-1,dmfwv3y,"&gt;“After calling 420-plus charities with some connection to Trump, The Post found only one personal gift from Trump between 2008 and the spring of this year,” Fahrenthold added. “That was a gift to the Police Athletic League of New York City, in 2009. It was worth less than $10,000.”

That's *extraordinarily* stingy for even a moderately rich person, much less a supposed billionaire.",1504299405,t3_6xhcz4,Massachusetts
dn9a3nu,-1,0,0,dn9a3nu,"Is this the same Jimmy Kimmel that gave Hillary a pre-opened bottle to open on air during the campaign, in order to show how healthy she was?",1505910074,t3_71adm4,
dnpwfxs,1,0,0,dnpwfxs,"Remember that time Obama tweeted from a golf course that Americans suffering in a federal disaster area needed to suck it up and quit whining?

Yeah, I don’t remember that either.",1506786173,t3_73fbka,
dqqt008,0,1,1,dqqt008,"Um, I'm sorry, is he or is he not the President of these United States? So hows about you guys BACK OFF and stop flinging FAKE NEWS at him? President Trump came into office with a landslide majority (57% !). The People are with him, and he is with the People.",1512385589,t3_7hemmg,
dsp0v6d,-1,0,0,dsp0v6d,"I forgot, this sub is supposed to be a Democrat echo chamber where they can do no wrong. I'm not a Trump supporter btw.",1515982396,t3_7qgjbe,
dbbbr7q,-1,1,1,dbbbr7q,"&gt; Thanks Trump supporters!  
  
You're quite welcome, and by the way you'll be thanking us some day for keeping Hillary Clinton out of the White House.",1482000212,t3_5ivmgb,Oregon
dc9oka8,-1,1,1,dc9oka8,"January 20th will be glorious. DONALD J TRUMP will be the 45 president of the USA, and we will Make America Great Again! All of these sad liberals are on the WRONG side of history, and they will be REKT hard. There are no brakes on this train. CHOO CHOO!

Don't cry here. Donate your salty tears to dying children with sodium deficiencies. 

Hillary Clinton will NEVER be president.",1484100582,t3_5n8z88,
deg6ubj,-1,1,0,deg6ubj,"This article is a month old...democrats are realizing their Blitzkrieg on Sessions didn't work so now they're trying to scrounge of every last bit of mud to fling at the wall and pray something sticks.



Otherwise they'll have to actually get to work legislating. That would be tragic for them, apparently.",1488522159,t3_5x8ki5,Massachusetts
dfhwewl,-1,0,1,dfhwewl,"Yeah, because the Washington Post is a really trustworthy source and all. I mean, they are completely unbiased when it comes to analyzing President Trump. /s

If you really want to see foreign collusion, just look at the Clinton campaign.",1490668240,t3_61wkv7,
