Input_id,labeldem,labelgop,labeldjt,id,body,created_utc,link_id,author_flair_text
d9idp5c,1,-99,-99,d9idp5c,"Hopefully he can have a lawyer as skillful as a young HRC, so that way we can just laugh about how he got off.

Edit: I can't believe the down votes I'm getting for praising Hillary's prowess in the field of law.",1478097423,t3_5apyov,
da7etlb,-1,1,1,da7etlb,"Obama has little capital to spend except for cult of personality.  Going out of his way to pick a fight with a setting President when you hold zero power of any kind except for Facebook likes is a bad idea.  Obama refused to prosecute Bush for war crimes, but Trump might not be so lenient in regards to Obama.",1479591775,t3_5du9t2,
dbhagub,-1,0,0,dbhagub,"Hillary is completely done, and Sanders and Biden are too old. Obama needs to spend the next four years taking an \"America's Got Talent\" roadshow across America looking for someone under 60 who can actually get the vote out.",1482355560,t3_5jmfb7,
decrz39,0,0,-1,decrz39,"HA HA, yes! He's not electing lifelong Democrat politicians! He's getting people who weren't even politicians at all. That clearly means he's not draining the swamp! So funny!",1488342119,t3_5wsrxk,
dnwia2s,-1,1,1,dnwia2s,"Or, even more plausible:

1. Trump elected president.

2. Washington lifers don't like it.

3. Leak dishonest info regularly to stir shit up in hopes of a 2020 win. (Please don't be naive and act like this doesn't happen)

4. White House denies it because its innaccurate.

5. Repeat steps 3 and 4.",1507136531,t3_748su4,
dpxxzuk,0,-1,-1,dpxxzuk,"Trump's tweet from 20 minutes go:

&gt;\"The Al Frankenstien picture is really bad, speaks a thousand words. Where do his hands go in pictures 2, 3, 4, 5 &amp; 6 while she sleeps? ......And to think that just last week he was lecturing anyone who would listen about sexual harassment and respect for women. Lesley Stahl tape?\"

The fucking gall to not address Roy Moore at all this week and then tweet this out. FUCK DONALD TRUMP.",1510889292,t3_7dhymu,
dsl5tls,0,-1,-1,dsl5tls,"OMFG, it never ends.

&gt; Another adult-film star, Jessica Drake, later alleged in an October 2016 news conference that Mr. Trump kissed her and two other women without permission in a hotel suite after the same 2006 golf event.

so, I guessing that this one probably happened then.",1515788187,t3_7pzc0a,New York
dumh3r8,-1,0,0,dumh3r8,"Openly colluding. 

\"Oh its just a joke. He is making fun of paranoia of Democrats\"

Yeah, no. Our national security is not a joke.",1519255769,t3_7za1vs,
de583k1,1,-1,0,de583k1,"Remember when Obama did town hall meetings and the tea party kept showing up? 

He never made up excuses and refused to attend them",1487911160,t3_5vvbch,
dfpjdig,0,-1,-1,dfpjdig,"&gt; Though Trump's lawyers argue his words were protected speech under the First Amendment, the court disagreed. \"It is plausible that Trump’s direction to 'get ’em out of here' advocated the use of force,\" Judge Hale wrote. \"It was an order, an instruction, a command...Trump’s statement at least implicitly encouraged the use of violence or lawless action.”

Yup. Encouraging an illegal act is not protected speech. Encouraging? Hell, he was demanding it...",1491088289,t3_62w4cd,Massachusetts
dfvm63f,0,0,1,dfvm63f,It must really suck to be against president Trump. You have to keep up with a lot of fake news like this. Lucky for you CNN has a new way of saying there is no evidence of Russia collusion every single day for you to talk about.,1491422481,t3_63mhxt,
dhnbq55,0,-1,-1,dhnbq55,"Buried in all the other juicy details is this horrific tidbit:

&gt;Alone in the Oval Office, Mr. Trump began the discussion by condemning leaks to the news media, saying that Mr. Comey should consider putting reporters in prison for publishing classified information, according to one of Mr. Comey’s associates.

Jesus Christ he is a fucking menace.",1494970896,t3_6bkcss,
di9qmgs,0,-1,-1,di9qmgs,"&gt;But perhaps the most salient detail is Trump’s insistence that Carter Page has information that “blows away” the Democrats’ “case against him” in the Russia scandal. This, of course, leads to an awkward question: how exactly would the president know that?

Remember Trump claims never to have met the guy.",1496237992,t3_6eezpd,
dloilr2,0,0,1,dloilr2,Not condemning is not the same as siding with them. I'm not a trump supporter at all but at least be intellectually honest about this.,1502844283,t3_6tx8h7,
dpx8esh,-1,0,0,dpx8esh,"True. A lot of millennials seem to have abandoned the notion of earning your way up, and thay are now turning to silly memes of \"late stage capitalism\" and \"democratic socialism\" which are just repackagings of the same failed, genocidal ideology that was tried in the USSR and Venezuela.

Based on my downvotes, it seems that this 'millennial leftism' has overtaken the adult neoliberal consensus once again as the dominant narrative on r/politics.",1510861323,t3_7de7if,
dq5ocy7,0,-1,0,dq5ocy7,Child rape really shouldn’t be a Left/Right issue.  Wow the GOP has really gone off the deep end.,1511296494,t3_7ekxlu,
dter73n,0,0,-1,dter73n,"It would hurt them more than it hurts us. Everyone wants to sell to the United States. It's the largest economy in the world. Millions of people able to buy stuff... A capitalist's dream! I couldn't say whether trade restrictions are appropriate. Seeing as how Trump made the statement, probably not.",1517231974,t3_7truud,
du7kgad,1,0,0,du7kgad,She was running against a strong Republican candidate and turnout was high all around. Good's victory is big news for Democrats in Florida.,1518569137,t3_7xe50q,Ohio
dhsshec,-99,-1,-1,dhsshec,"Why Clinton aside? Do you think that the outcome of the race should have been immediate impeachment whether Trump *or* Hillary was elected, if they're both held to the same standards?

Comey already pulled this get out of jail free card for Hillary, so it would be a wild double standard to say somehow it doesn't apply to Trump now",1495256174,t3_6c8eqt,
dptcqqs,0,-1,-1,dptcqqs,"Your move, Trumpsters. 

Insnaely far-right ex-Senator and Trump's personally-appointed Attorney General says there's no evidence for your dumb fucking conspiracy theories. 

Yet we've got an elite special counsel pursuing Trump barely a few months into his presidency.",1510682668,t3_7cxfbt,
dr5wlqs,-1,1,0,dr5wlqs,Dems have been lying to the country and disrespecting the troops and our flag for centuries. I have never seen such an embarrassment for our country. I will vote Republican until the day I die. If your a Democrat today must suck because Moore is a patriot .,1513125525,t3_7jb1t7,
ds9ucv5,-1,1,1,ds9ucv5,"Trump makes a tweet 37 minutes ago, The Hill makes this completely empty article ten minutes after, OP posts this thread five minutes after that. This is how you know the media/this subreddit is simply a Democrat mouthpiece desperate for clicks, it's a non-story and no one cares.",1515244196,t3_7oj131,West Virginia
dsyjgbo,1,-1,0,dsyjgbo,"McConnell once filibustered his own bill because Reid caught him off guard by liking it and letting it come up for a vote.

A different time, there was a Congressional override of an Obama veto and then McConnell blamed Obama for the problems with the bill.",1516431203,t3_7roatu,California
dsz92d8,0,0,-1,dsz92d8,"Amazingly, that is how Stormy Daniels described having sex with him.

edit: Thank you mysterious redditor, I've never been given gold before.  And it happens because of a Trump sex joke.  Eww.",1516477921,t3_7rs54q,Connecticut
dti2in8,0,1,1,dti2in8,"USA! USA! USA! USA! USA! USA! USA! USA! USA! USA! USA! USA! USA! USA! USA! USA! USA! USA! USA! USA! USA! USA! USA! USA!
USA! USA! USA! USA! USA! USA! USA! USA!

God bless America and God bless our amazing President Donald John Trump!",1517369359,t3_7u59v9,
du8u73x,0,0,-1,du8u73x,"&gt;Daniels, whose real name is Stephanie Clifford, believes Cohen’s admission that he paid her amounts to a breach of their contract and frees her from “further performance of the non-disclosure agreement” between the parties, the website said.


Because Trump only hires *the best people*, guys. Bigly smart people.",1518632556,t3_7xk2lb,California
daf6t3x,0,0,1,daf6t3x,"Eight years, and as a Trump voter, I agree it will be a blast as he makes America great again.",1480091651,t3_5etnnw,
dq1vnoc,0,0,-1,dq1vnoc,There you have it folks. Trump wasn't praised enough so now he wants to take it back. He only did this to make himself look good.,1511114584,t3_7e25r3,
dqp80sm,-1,0,0,dqp80sm,"He inherited a mess. Comey and Obama fucked it up so bad.

Edit: comment stands at -70 after only 5 minutes. I'm so proud of this new record. Must have hit a nerve.",1512308350,t3_7h9lzg,
dcnp5c5,-1,0,0,dcnp5c5,Liberals can be so cute sometimes. Did anyone expect a good concert when all the Jesters are liberals as well? The article breathlessly bashes the concert as if there was ample talent available and no one wanted to come. The Jesters want to continue their employability so they are wise to stay away.,1484883212,t3_5p1gb8,
dcsz832,0,0,1,dcsz832,This is a great victory for the unborn children who don't yet have a voice to scream for the autonomy over their body. Catholics throughout the world owe President Trump their gratitude for this brave action.,1485194751,t3_5pqdc5,
dd5e6ef,0,-1,0,dd5e6ef,"...And yet that did not stop her confirmation by a Senate subcommittee just now by a vote of 12-11. 

The \"Ayes\"? All Republican. Right down party lines.

/Disgusted",1485881530,t3_5r97fu,
dgh4rsx,0,-1,-1,dgh4rsx,"This really is starting to look like the emperor has no clothes situation. Between Paul \"Ron\" Ryan and \"The gentleman\" from North Korea it seems Trump is having a hard time remembering the names of some pretty important people.",1492621484,t3_66bi1n,
djk80i1,0,0,-1,djk80i1,"Who started it?

&gt;\"Nothing makes a man feel better than making a fake cover of a magazine about himself, lying every day, and destroying the country,\" Brzezinski said. Brzezinski also noted that on the fake Time cover, Trump was covering his hands \"because they're teensy.\"

\"Trump said mean things about me after I said mean things about him wah wah I'm being abused\"",1498751522,t3_6k91g3,
dl4s07v,-1,1,1,dl4s07v,"The guy is a Democrat. He's doing everything he can do blow this nothing burger out of proportion. He knows a slow, and drawn out process will damage the President and that's exactly what he aims for. 

On the bright side, once the grand jury finds clears Trump's campaign team of any wrongdoing, nobody will be able to complain that the process was not adequate.",1501800215,t3_6rf8bk,
dc5qag9,0,-1,-1,dc5qag9,This is also the same guy that filibustered himself because a Democrat agreed with him. McConnell is pretty much hypocrisy incarnate.,1483890631,t3_5mr4bh,
dcratzl,-1,1,0,dcratzl,"The disgusting and misogynist alt left can't stand that Kellyanne was the first woman to successfully run a presidential campaign.  They can't stand a woman being in such a high position of power in our great country.  So they do nothing but rag on her.  Real nasty individuals, only Republicans care about this woman and her great achievements in life.",1485104549,t3_5phxw9,
ddnpq0l,0,-1,-1,ddnpq0l,"This is why humiliating Trump is so vital.

He only has the power we give him.  

Laugh in his face and spit in his beer.",1486928332,t3_5tnkxm,
dlfzpqc,0,-1,-1,dlfzpqc,"&gt; “I want to thank him because we’re trying to cut down our payroll and as far as I’m concerned I’m very thankful that he let go of a large number of people because now we have a smaller payroll,\" Trump told reporters at his Bedminster, N.J. golf club.

Traitor.",1502397896,t3_6sw7w3,
dumoe0i,-1,0,1,dumoe0i,"He IS enraged, but for the wrong reasons.  He's just mad that Trump came up with a good response for gun control, but it's not the one liberals wanted.",1519263743,t3_7zb07v,
dbg94aw,0,0,1,dbg94aw,Vegas had 6:1 odds in Trumps favor. People knew he was going to win if they bothered to think critically and do research.,1482290266,t3_5jhe43,
dd8z9zu,0,0,-1,dd8z9zu,"&gt;Almost half of Trump supporters were in favour of the order, however, and 48 per cent believed the protesters at airports around the country - as well as people at the women’s marches - were paid by billionaire investor and Hillary Clinton supporter George Soros.

48% believe all those protesters were paid? Are these people REALLY that brainwashed???",1486065437,t3_5roy6v,
ddc8s0s,1,-1,-1,ddc8s0s,"A regular President would do this from the start. You need not have to tell an adult to wipe his ass. 

Unfortunately, we have a romantic vision of outsider/anti-establishment and such a dark view of regular politicians. We forget that this kind of stupid and outright dangerous behaviour and actions won't have happened if Hillary/Mitt/Obama/McCain were President.",1486252562,t3_5s34nk,
ddjg6jy,0,0,-1,ddjg6jy,"&gt;Trump then told Putin the treaty was one of several bad deals negotiated by the Obama administration, saying that New START favoured Russia. Trump also talked about his own popularity, the sources said.

He didn't know what the treaty was, but decided to say that it was a bad deal anyways. Awesome. Our CIC wants nuclear proliferation. Anyone scared yet?

Also, of course he talked about his popularity.",1486664571,t3_5t1rid,
djatjbe,0,0,-1,djatjbe,"October 7, 2016

3:30 p.m. - Obama administration releases statement (timed for maximum media coverage) that Russia was hacking the election.

4 p.m. - Story breaks of Trumplethinskin's grab 'em by the pussy tapes.

4:30 p.m. - Wikileaks releases the first batch of emails stolen from the Clinton campaign's chairman John Podesta.",1498232232,t3_6j1hn2,
dnizoln,0,-1,0,dnizoln,"Trump pays no penalty for hypocrisy. He can golf all he likes. He can use whatever email he likes. He can employ all the Goldman Sachs VPs he likes. It doesn't matter to his supporters. It's not what he does that matters, it's who is doing it - Dem bad, Trump good.",1506426331,t3_72jggo,
dqo8ith,0,0,-1,dqo8ith,"&gt;A White House lawyer told The Times that McFarland was referring to the Democrats' portrayal of the election. 

Mmm. No Democrats were  mentioned.  I think that lawyer should be cross-examined.",1512250335,t3_7h5e73,America
dskowck,-1,1,1,dskowck,"An adult that ran up the national debt, gave us shitty healthcare, and raised taxes. 

I'll take Trump ANY day of the week.",1515771779,t3_7pvo86,
dt5c32l,0,0,-1,dt5c32l,"All this time I've been wondering why Trump had such a hard on to get rid of McCabe. I mean, sure, he's a witness to the Comey thing but does that really warrant more rocking the boat even more than its been rocked?


Its clear now. Trump is going after McCabe for the same reason he went after Comey; their silence wasn't for sale and that eats him up inside.",1516761555,t3_7sjbj2,
dt93mjm,0,0,1,dt93mjm,Came here for this. After over a year you think they'd be able to spot these tells that the news is fake.  President Trump is about to catch himself another leaker.,1516933094,t3_7t12e6,
dtalzlh,0,-1,-1,dtalzlh,"This is pretty big news and fits in with other stories from the last couple weeks.

The idea that Trump is now targeting specific FBI officials in very personal attacks is mind boggling. He's attempted to oust McCabe, to get him fired and used similar tactics on at least two others, according to this story.

I wonder who else he has tried to pull under? It's almost like Trump is out to prove his own guilt.",1517005390,t3_7t84ut,
dti4sh1,-1,0,0,dti4sh1,"This guy is an obvious push by the DNC. It's Hillary2.0. Dont fall for it again.

Bring on the downvotes, bitches! I know I'm right.",1517371624,t3_7u72va,
dd1rbve,0,0,1,dd1rbve,"President Trump will do whatever is necessary to ensure the stability and prosperity of this great nation. I stand by him 100%. 

**EDIT:** To everybody sending me death threats and calling me a \"highschool drop-out piece of redneck white trash\", I'm in medical school, am half Iranian, and brought myself out of welfare to get where I am today. Very tolerant of you all.",1485671714,t3_5qrh93,
ddclv90,-1,0,0,ddclv90,"Haha. Not going to happen. The people spoke a mandate was issued. Bernie, socialism, single-payer, Hillary and all of Obama's failed policies were soundly rejected. 

We still have a long road back but journey has begun.",1486272515,t3_5s5tv8,
djeylj6,0,0,-1,djeylj6,"Trump's use of \"colluded\" and \"obstructed\" is completely intentional, and can only be understood as a desperate attempt to smokescreen the building cases of collusion and obstruction against him.

He has now accused both Clinton and Obama of \"collusion\" -- and has just (for the first time) accused Obama of \"obstruction\" -- keep an eye, he will definitely be using these terms with greater frequency.",1498482042,t3_6jkwrl,
dn0cqvm,0,0,-1,dn0cqvm,"&gt;When the phone call ended, Mr. McGahn relayed the news to the president and his aides. Almost immediately, Mr. Trump lobbed a volley of insults at Mr. Sessions, telling the attorney general it was his fault they were in the current situation. **Mr. Trump told Mr. Sessions that choosing him to be attorney general was one of the worst decisions he had made, called him an “idiot,” and said that he should resign.**

Wew.",1505418317,t3_704lga,
dn0cqvm,0,0,-1,dn0cqvm,"&gt;When the phone call ended, Mr. McGahn relayed the news to the president and his aides. Almost immediately, Mr. Trump lobbed a volley of insults at Mr. Sessions, telling the attorney general it was his fault they were in the current situation. **Mr. Trump told Mr. Sessions that choosing him to be attorney general was one of the worst decisions he had made, called him an “idiot,” and said that he should resign.**

Wew.",1505418317,t3_704lga,
dn0cqvm,0,-1,-1,dn0cqvm,"&gt;When the phone call ended, Mr. McGahn relayed the news to the president and his aides. Almost immediately, Mr. Trump lobbed a volley of insults at Mr. Sessions, telling the attorney general it was his fault they were in the current situation. **Mr. Trump told Mr. Sessions that choosing him to be attorney general was one of the worst decisions he had made, called him an “idiot,” and said that he should resign.**

Wew.",1505418317,t3_704lga,
dn0cqvm,0,-1,-1,dn0cqvm,"&gt;When the phone call ended, Mr. McGahn relayed the news to the president and his aides. Almost immediately, Mr. Trump lobbed a volley of insults at Mr. Sessions, telling the attorney general it was his fault they were in the current situation. **Mr. Trump told Mr. Sessions that choosing him to be attorney general was one of the worst decisions he had made, called him an “idiot,” and said that he should resign.**

Wew.",1505418317,t3_704lga,
dpc7x89,0,0,-1,dpc7x89,"*\"Russians make up a pretty disproportionate cross-section of a lot of our assets. We see a lot of money pouring in from Russia.\"* —Donald Trump Jr. in 2008

*\"Well, we don’t rely on American banks. We have all the funding we need out of Russia.\"* —Eric Trump in 2014

Investigate the old real estate deals.",1509812799,t3_7arkfl,New York
drpng8t,-1,1,0,drpng8t,"Ngl, I moved a lot of my political giving to the GOP after seeing the neo-Marxist freakshow that is the democratic party.

Maybe when the Berner Rebellion is finally subsumed to the prevailing tides of history, and the pre-millennial neoliberals take back the party, I'll consider restoring my support to Wyden, Harris and Gillibrand.  But right now, the interests of capital are only being promoted by the congressional GOP.",1514145909,t3_7lwmhf,
ds3ueyr,0,0,-1,ds3ueyr,"&gt; \"North Korean Leader Kim Jong Un just stated that the 'Nuclear Button is on his desk at all times,'\" Trump tweeted. \"Will someone from his depleted and food starved regime please inform him that I too have a Nuclear Button, but it is a much bigger &amp; more powerful one than his, and my Button works!\"

Anderson Cooper: That is real. This just happened.",1514941491,t3_7nqzj5,
dt7rd5a,0,-99,-1,dt7rd5a,"TIL: opium has been around thousands of years and has been the source of international conflict from the 1830s through to the Reagan and Obama administrations - but if Trump doesn't solve it, that shows he's not effective",1516882918,t3_7svj0n,
dttpxlh,0,0,-1,dttpxlh,"&gt; During an interview on Good Morning America on Tuesday, Carter Page admitted that he served as an adviser to the Kremlin before joining Donald Trump’s campaign for president. But he doesn’t think the FBI had good reason to view that as suspicious.    

What planet is this guy from???",1517931400,t3_7vnyen,California
dtvuoia,0,-99,1,dtvuoia,"*\"President Trump is incredibly supportive of America’s great service members who risk their lives every day to keep our country safe,\" White House press secretary Sarah Huckabee Sanders said. \"He has asked the Department of Defense to explore a celebration at which all Americans can show their appreciation.\"*

You mean like Veterans day? or Independence day? Cause there is usually a whole lot of love for military around those days.",1518023417,t3_7vxd5t,
dc5o2br,-1,0,0,dc5o2br,Democrats are deflecting the blame towards Russia instead of taking responsibility for their own failure. The Russians didn't make Donna Brazile give Hillary questions.,1483886683,t3_5mr05g,
dfrnrp8,-1,1,1,dfrnrp8,"&gt; Joe and Mika were in utter disbelief that Trump tweeted about his debate with Hillary this morning when there are more urgent issues right now such as North Korea, middle east, etc.

Kushner's in Iraq and Trump is meeting with President Xi, but of course Trump spending 15 seconds on a tweet is very, very bad.

This is why the alt-right laughs at you. This is why the alt-right is winning.",1491223822,t3_636aan,
dllz6a9,1,-1,-1,dllz6a9,"&gt;Barack Obama's message of unity after a far-right, white supremacist event in Virginia descended into deadly violence has become the third most ‘liked’ tweet in history

Wow. Another thing that Obama is better at than The Donald.",1502727269,t3_6tne0r,Tennessee
douozjr,-1,0,0,douozjr,"Lol the dems are falling apart at the moment! Even CNN is starting to talk about the Russian scandal connected with Clinton and Podesta, we are not here because we are watching your party crumble on TV at the moment. Soros will be next! So you are going to have to think of a new username soon",1508902389,t3_78kuic,
dttvmsu,-1,0,0,dttvmsu,Very embarrassing for democrats. Now I know why they fought so hard to keep it classified even though no methods or sources were revealed. Completely discredits these treasonous attempts at overthrowing a democratically elected president. SAD!!!,1517936862,t3_7voov4,
db7fzpg,1,-1,-1,db7fzpg,"\"What began as a \"vendetta\" against Hillary Clinton morphed into an effort to show corruption in American politics and to \"split off key American allies by creating the image that [other countries] couldn't depend on the U.S. to be a credible global leader anymore,\" the official said.\"


He did a damn good job.
 
 
 
 
fuck putin. fuck russia.",1481758996,t3_5ie2gx,
ddqz214,-1,0,0,ddqz214,Get this thread out of /r/politics and into /r/entertainment or /r/television. This sub is garbage now and has been since the Democratic National Convention.,1487108367,t3_5u34rg,
dl53a95,-1,1,1,dl53a95,"Trump signed sanctions for Russia. Obama gives Putin Crimea

Trump is being investigated for links to Russia. Clinton Foundation walks away scott free.  


There are shows that parody trump. There were zero shows parodying  Obama.  


 MSM is losing trust by the day. MSM greatest failure was convincing everyone to vote for Hillary. The slide into the void continues.",1501814591,t3_6rf8bk,
dnw40xc,0,-1,-1,dnw40xc,At least Tillerson wants the world to keep spinning. Trump just wants to burn it all down.  This is terrifying when the ex-CEO of Exxon is a voice of reason.,1507120525,t3_747d4t,Texas
dp1xyqb,1,0,0,dp1xyqb,"yesterday Fox News tweeted about Clinton/ Uranium One/ Steele dossier 40x. They tweeted about the pending Mueller indictments 3x. 

What would Fox ever do without the Clintons?",1509295502,t3_79hgw7,
drpjdug,-1,1,1,drpjdug,A lot of dumb sh*t costs way more than his travels. So stop complaining like he is going to put us in more debt like Obama.,1514141348,t3_7lw3ma,
dseeb28,-1,1,1,dseeb28,"Huge crowd of supporters for Trump finally bringing some respect to the flag and country.  Much needed since Obama tore this country in half. Thanks Trump For MAGA!!!

Edit: ;)
Edit 2: Go Dawgs!!!! Alabama is full of losers like Roy Moore T told me!",1515468290,t3_7p48xh,
dtge57r,-1,0,0,dtge57r,"The narrative is going in to hyper drive. The fake news media are scared of the memo's imminent release.


Why do you people want war and increased tensions with Russia? I thought democrats hated war and violence and escalation? Why are you all so xenophobic towards Russians? Where is the famous Democratic tolerance?",1517297586,t3_7ty9ot,
dtgryv4,-1,0,0,dtgryv4,"One reason, I believe, high ranking Democrats don't say anything about this is that there are Democrats compromised by Russia, or business dealings with links to Russia.

Some people say they are only leaving Mueller do his job, but he is about to get fired and Republicans will not impeach.",1517323936,t3_7u18ph,
dd1v3o2,-1,1,1,dd1v3o2,Fuck you all racist islamist anti-Semite liberals cuk suckers. We won u lost. Move to syria or iran if u r not happy in trumpland.,1485680877,t3_5qrh93,
