Input_id,labeldem,labelgop,labeldjt,id,body,created_utc,link_id,author_flair_text
dkhj3he,0,0,-1,dkhj3he,"&gt; Incredibly, in order to avoid paying the $40 million he had personally guaranteed, Trump and his lawyer argued that “Deutsche Bank is one of the banks primarily responsible for the economic dysfunction we are currently facing”—i.e. the global financial crisis—and therefore it should pay him $3 billion in damages under the extraordinary event clause in his contract. Naturally, the bank countersued, calling the real-estate developer’s claim “classic Trump.”",1500575967,t3_6oi32s,
dksf42v,0,1,0,dksf42v,"Thug. Does he know any Alaskans? They don't take shit like this.  They elected Lisa Murkowski over a tea party thug on a WRITE IN vote, first time in the modern era for a senate race. Her father was a beloved governor. She is well liked by Alaska's oil industry and Native communities and majority republicans. You do not come after Lisa Murkowski or Alaska, you pencil-dicked vulgarian.",1501155795,t3_6pv1n5,
dskg83h,0,1,1,dskg83h,"lol, so you're just openly asking for a coup? Sorry to tell you that Trump will be your president until 2020, there will be no conviction of Trump.",1515759906,t3_7pw7kp,
ddq7awb,-1,0,0,ddq7awb,This guy more or less got fired during the Obama administration for not wanting to arm ISIS. There was no way he was gonna get a pass by the same media enamored with the DNC.,1487071813,t3_5txxzt,
dilhnn1,-1,0,1,dilhnn1,"It amuses me how ppl think asking for loyalty is a bad thing. 

Hi Mr FBI director Comey, prez Trump here I'd just like to ask that you be someone I could never trust. Lol fucking idiots",1496869352,t3_6fv8bi,
do9vgqh,0,-1,-1,do9vgqh,"There is a big difference between players silently kneeling during a pre-game anthem and Trump talking through the flag lowering. 

NFL players did it in protest of mistreatment of us citizens. Trump did it because he loves the sound of his own voice and thinks he is the most important thing/person in every setting.",1507829096,t3_75yh95,
dtfusu9,-1,1,1,dtfusu9,Mueller will be shining my shoes once everyone reads that memo tonight. I will defend maga to my dying breath. Submit to trump bois. You don’t stand a chance.,1517272218,t3_7tu63m,
daq99ux,-1,1,1,daq99ux,BLM is nationalist and socialist.  Literally more Nazi than Trump.  Any organization or belief that is nationalist and socialist is more nazi than Trump.,1480745494,t3_5g7wxb,
ddqdr6y,0,-1,-1,ddqdr6y,"For fucks sake, this is the *THIRD* motherfucker thrown out of the Trump campaign/administration for unseemly ties and shady actions regarding Russia, of fucking COURSE nobody is moving on.",1487084118,t3_5u0i7m,
dfmx2vp,-1,0,1,dfmx2vp,Any proof yet? Gonna keep these spicy headlines coming liberals? They've been sooooo effective! They really helped sway the election against trump!!,1490931109,t3_62hv7o,
diltxv6,0,-1,-1,diltxv6,"Media: Trump fired Comey to protect himself 

Conservatives: No he didn't! Fake news! 

Trump: I fired Comey to protect myself! 

Americans: I dunno...",1496884627,t3_6fxory,
dip6klb,0,1,1,dip6klb,"Al Franken specifically asked if Jeff Sessions ever met Russians as a surrogate as a member of the Trump campaign (full stop), his answer was NO. That was true, Sessions statement was truthful because he met with the Russian ambassador in his capacity as a senator, not as a Trump campaign surrogate.",1497055687,t3_6gc9hb,
doujgv2,-1,0,1,doujgv2,What about the report that just came out about Manafort and how sent Russian money through the podesta group to support Clinton? Manafort never planned on being fired by Trump until he was. Trump can usually tell when someone was against him.,1508895638,t3_78kc8r,
dtfk428,-1,1,1,dtfk428,This is just the beginning. We will remove all the former Obama era and Democrat members and place in good loyal people. Our President deserves no less!,1517261454,t3_7tu63m,
dcyq8of,-1,1,1,dcyq8of,"This is the funniest hair-on-fire liberalism I've seen yet. 

The whole editorial boils down to, \"Trump disputes the number of people at his inauguration, ergo he is a dictator.\"

The media doesn't seem interested in winning us Obama voters back. 

It's going to be a LONG eight years for the leftists.",1485489543,t3_5qezoi,
dhg2hub,0,0,-1,dhg2hub,"&gt;&gt; **As they ate, the president and Mr. Comey made small talk about the election and the crowd sizes at Mr. Trump’s rallies.** The president then turned the conversation to whether Mr. Comey would pledge his loyalty to him.

Well, that's how you know it's a true story.",1494549137,t3_6ao49f,
diuvmom,-1,1,1,diuvmom,"today

- russia narrative dies

- comey's treason will be highlighted. 

- mueller will be fired

- the criminal democrat holdovers will begin dropping like flies


**your delusional \"resistance\" is a joke.**",1497381404,t3_6h0i7p,
dqz1v0b,-1,1,1,dqz1v0b,"I know this is typical ShareBlue FAKE NEWS, but we can at least hope.  Mueller crossed Trump's red line, and Trump has every right and reason to fire him.  As for the antifa riots, there's always the military. :)",1512773981,t3_7iinud,
dsucpcd,-1,1,1,dsucpcd,"Can’t get anything done? 

Under Republican control we’re seeing record highs in the stock market, record low in unemployment, ISIS crushed in the Middle East, tax reform, travel ban, Gorsuch appointed, etc.

The only thing republicans haven’t done is cater to the fringe social issues the loony left obsesses over.",1516233244,t3_7r5ea7,
dtngnay,-1,0,0,dtngnay,"You dont think this makes the IC, DNC and clinton campaign look bad? They paid for a dossier authored by Steele, they corroborated said dossier through a yahoo news report that used Steele as the source. That's some slimy shit to use to spy on anyone.",1517613563,t3_7uut1q,
d9raj5q,0,0,-1,d9raj5q,"There was a lady on a megaphone outside Trump Tower the other day, shouting \"On November 8th, elect Donald Trump and make America great again!\"

Loud outbursts of laughter, every time. New Yorkers were the first people to think he was a joke.",1478624969,t3_5bufsq,
deh2nyg,-1,1,1,deh2nyg,"Do I have evidence that it's part of a Senators job to meet with foreign ambassadors? Yeah, it's in their job description. 20 out of 26 senators said what? FAKE NEWS. You realize that you are making the argument that Sessions worked with the Russians to elect Trump. Please provide proof of this.  Please provide any evidence AG Sessions broke any rule whatsoever and I'll take you seriously.",1488574113,t3_5xcl6c,
dg8ip19,0,-1,-1,dg8ip19,"Trumps investigation in Hawaii. 

Sean Hannity waterboarding himself.

Trump unveiling a plan to defeat ISIS. 

Trump making Mexico pay for the wall... 

A bunch of unfulfilled promises.",1492131392,t3_659fv6,
dhd9xvd,0,0,-1,dhd9xvd,"The idea that he thinks the American public would buy his story that he fired Comey for being mean to Clinton... It's ridiculous. Every time Russia gets into the news, he fires a top cop near to him.",1494410533,t3_6abqop,
dhpugha,0,0,-1,dhpugha,"He also just tweeted out:

&gt;This is the single greatest witch hunt of a politician in American history!

Uh, no. I seem to remember something something Obama birth certificate.",1495109336,t3_6bvq6v,
diojydt,0,0,-1,diojydt,"Good thing we elected a \"billionaire\" who literally lives on the top of a tower with his name on it. That'll fix that elitism that Obama showed.",1497027830,t3_6g9c2j,
dlwe9h6,-1,0,1,dlwe9h6,"Trump is going to win again easily in 2020.

Democrats have shown they have nothing to offer but fake controversies and pandering to entitled millennials and middle aged burnouts.",1503268676,t3_6uyti7,
donhaxc,-1,0,0,donhaxc,"Quick, liberals, post useless comments that bring Antifa into a situation that has nothing to do with Antifa.
Edit: It appears I’ve upset some people.
Edit 2: In actuality, the only people screaming Antifa here are liberals. Congrats?",1508529061,t3_77nzpj,
dr6qatw,1,-99,0,dr6qatw,"When democrats come out, we win. End of story.  All the gerrymandering and vote suppression just make it so we have to work harder to less decisive victories, but in the end, voter participation has always been the death knell for GOP candidates.",1513172362,t3_7jir4u,New York
drv1usu,-1,0,0,drv1usu,"Awww you Democrats and your feelings. Nobody gives a shit if you feel like you won, just if you got more votes than anyone else and actually won.",1514470657,t3_7mmsoc,
dt0bdxc,-1,0,0,dt0bdxc,"The Democrats are the ones who shut down the government. They still have more then 40 seats.

This is all on them, no matter how you spin it.",1516537387,t3_7rxbdi,
dt35v6w,0,-1,-1,dt35v6w,"Probably learned it from Trump: Lie as much as you want, your base will believe you no matter what you say.",1516664912,t3_7sa5jl,
d9wewyd,0,-1,-1,d9wewyd,"Great, so we just elected a Markov chain as president. Now we have to perform a daily ablution of Trump's brain just to be sure he doesn't do something too stupid.",1478901385,t3_5cgswr,
dik1zn0,0,0,-1,dik1zn0,"&gt;On March 22, less than a week after being confirmed by the Senate, Director of National Intelligence Daniel Coats attended a briefing at the White House together with officials from several government agencies. As the briefing was wrapping up, Trump asked everyone to leave the room except for Coats and CIA Director Mike Pompeo.

Lesson learned: if trump asks all other people to leave the room, leave with them.",1496794438,t3_6fpun3,
djk7lz7,-1,0,1,djk7lz7,"The fucking hypocrisy is astounding. Colbert and the lib pussies started it.

Oh now all of a sudden they piss their pants when trumps pushes back hard.

And if women want to disfigure themselves for ratings, THAT IS THEIR CHOICE.",1498751098,t3_6k8uch,
dl217ac,0,-1,-1,dl217ac,"Dear Senate Republicans, 

What specifically did you see in Trumps whole campaign that made you think - that is a remarkable person I want to follow. 

Most of you are hypocrite BS artists. Some I assume are good people.",1501675261,t3_6r3ls4,
dmog6pl,0,-1,0,dmog6pl,"Even though he thinks Hurricane Irma is a liberal hoax, Rush Limbaugh will be stocking up on essentials like Oxycontin",1504781041,t3_6ymc0v,
dszee1x,-1,1,1,dszee1x,"the government  shut down issue caused by democrats unwilling to approve a budget  without daca, is only going to push more voters to Republican.  All of this over ILLEGAL  immigrants, putting their needs above those of Americans.  

Despicable and shameful, but will open the eyes of even more voters.  The democrats have dug themselves a massive hole and only keep making it worse.",1516484429,t3_7roei1,
dt0n48p,0,1,1,dt0n48p,"Excellent, good to see that both Trump and the Senate GOP are both on message with this.  I was afraid we were going to have to rely on the House GOP to stand firm against a shitty DACA \"deal\"",1516555649,t3_7ryyzb,
dbf6ztw,0,0,-1,dbf6ztw,"&gt;**Donald Trump employs his own** private security and **intelligence service** and plans to continue to do so as president. 

Trump having his own security team bothers me but not as much as him having his own intelligence force. Before you know it, they'll tap into NSA capabilities and make Watergate look like a nothingburger.",1482240865,t3_5jd67m,
dc5qdii,-1,0,0,dc5qdii,"Even if the hacking did happen, it wasn't what cost Clinton votes. It was DWS, Donna Brazile, and Clinton herself that did.",1483890764,t3_5mrbfw,
dctloz9,0,0,-1,dctloz9,"&gt; Trump spent about 10 minutes at the top of the gathering with Republican and Democratic lawmakers rehashing the campaign. Trump also told them that between 3 million and 5 million illegal votes caused him to lose the popular vote.

I'd bet my first born child that Trump will rehash his campaign every day for the next 1379 days.",1485220403,t3_5pt59n,Texas
dd4l41s,0,-1,-1,dd4l41s,"She was well aware of what was going to happen; she is a true American. 

Edit: Fuck Trump and President Bannon.",1485830353,t3_5r5hkm,Oregon
dgj7gvx,0,-1,-1,dgj7gvx,"This is a good example of why the whole \"talk to Trump supporters and work to change their minds\" is a losing strategy. It's a cult. They need deprogramming, not Socratic method argument. It's not rational.",1492722622,t3_66knmy,
djwdnww,0,0,1,djwdnww,"Misleading title and article it makes an assumption that Trump Russia collusion actually happened but as we all know their is no evidence to suggest this ever happened and may or may not be part of a on going investigation.
It also makes assumptions that are completely lacking in any evidence of more interferes based off unproven allegations.
This is poor writing at best.",1499430877,t3_6ltb03,
dms0ayb,-1,0,-1,dms0ayb,"Any Dem who works with Trump can fuck off--I don't care who it is. No one wants your dirty Russian money, Dorito Benito.",1504975937,t3_6z2r8z,
dn7ueud,0,0,-1,dn7ueud,"I heard his speech. The worst thing was when he was talking about unemployment and this and that, and I'm thinking, why does Trump think the UN gives a shit about this. I'm sure they don't. Holy shit, what a shit show.",1505835092,t3_713gbk,South Carolina
dp07pjj,0,1,1,dp07pjj,"Mueller is a worthy adversary, no doubt about it

But Trump will ultimately prevail. He always wins. And once he defeats the King of the Deep State (Mueller), it's smooth sailing for him.",1509191148,t3_799nj5,
dtgc7rw,-1,0,0,dtgc7rw,"Hello shill news. Memo released. Sorry vile Globalists. Obama was not as good at rigging the election and blaming those pesky Russians as you hoped. Try again in 2024. :D

Edit:   XD   oh my sides!",1517293834,t3_7ty9ot,
dd93um2,0,0,-1,dd93um2,"It's only been 13 days and 40% want to impeach? Not bad. 

Keep the conversation going, give the impression that impeachment is inevitable, this gets people comfortable with the eventuality and they'll get on board. Trump won't do anything over the next two or twenty weeks to help his case... I mean just this morning he went in front of the prayer breakfast to bitch about Schwarzenegger and ratings.",1486070522,t3_5rpbkr,
devsb7i,0,0,-1,devsb7i,"So incredibly damaging...

Who is going to believe Trump when he gives his 'word' at the G20?

You think Merkel will trust a damn thing Trump says when they talk?

Of course not.  Trump's statements are meaningless. His word is worthless.",1489433734,t3_5z738k,Texas
dgureks,0,1,1,dgureks,The political process takes time. Trump has already accomplished far more than most presidents have at their 100 day mark. The Obamacare repeal and replace is in the works.,1493349517,t3_680hmh,America
diorhdq,0,-1,-1,diorhdq,"I am 100% sure that Trump doesn't care if he lies under oath.  Why would he?  Other people in his administration lied under oath and had no problems, so why not him?",1497036130,t3_6gallr,
dithj8c,0,0,-1,dithj8c,"Go for it. 

For any Americans still on the fence, this should really drive it home: Trump is hiding something that Mueller will inevitably find. 

Edit: For what it's worth, this Friend, Chris Ruddy, was at the White House **today**.",1497309904,t3_6gw0cu,California
dogx9tl,0,0,-1,dogx9tl,Trump appointing someone related to the drug mafia to dictate drug control policy is very typical of his business career.,1508202554,t3_76uylr,
dtfjcbb,0,-1,-1,dtfjcbb,"Christ, what a fucking asshole. I'd say this is childish, but most children I've met behave better than this. *This* is the guy that the majority of Congressional Republicans are willing to debase themselves for.",1517260745,t3_7tvmmo,
dfplos2,-1,0,0,dfplos2,"This is a dangerous precedent.  We also have Obama's direction to a race-based group to \"Punish our enemies.\"  And after BLM had already committed many acts of arson, looting, assault, and attempted murder the DNC passed a formal Resolution of Support for their violence.  After that, BLM went on to commit mass murder.  Did the DNC cause that?",1491091776,t3_62w4cd,
dikwk6k,-1,0,0,dikwk6k,"There is no 'Trump-Russia investigation' 

There's only an intelligence investigation to get to the bottom of Russian interference.

You mentally unhinged liberals have been wrong in virtually everything.",1496847266,t3_6ftr7r,
dk8u0fb,-1,1,1,dk8u0fb,Will it be like when Maddow had that YUGE release and ended up proving that Trump paid tens upon tens of millions in taxes?! 😂,1500096911,t3_6nc6ne,
do5893o,0,0,-1,do5893o,"&gt; The Trump re-election campaign is now using the stunt to raise money, telling supporters, “your Vice President REFUSED to dignify” the players as they protested.

The fundraising email:

&gt; Please make a contribution of at least $5 to show your support and our team will send you an \"I STAND FOR THE FLAG\" sticker. 

Remind me which side was the one \"politicizing the national anthem\"?",1507592083,t3_75cqf6,
do78kr2,0,0,1,do78kr2,"This dis track is great

I am rapping so great

Eminem is not great

But I am doing great


He says I'm not great

But I am very very great

Bigly, so great

I told you I was good at this



Now, frankly this is the best

Dis track ever recorded 

That's what they're saying

Oh, pussy. Rhymes. Right.



I know that you're not great

Your unshaven face is not great

If you want to be great

Then vote for Trump and make America great, Eminem.  ##mage",1507689237,t3_75lwa7,
dpru3mv,0,0,-1,dpru3mv,"WUT THE FUCK

&gt;On October 3, 2016, Wikileaks wrote again. “Hiya, it’d be great if you guys could comment on/push this story,” Wikileaks suggested, attaching a quote from then-Democratic nominee Hillary Clinton about wanting to “just drone” Wikileaks founder, Julian Assange.

&gt;“Already did that earlier today,” Trump Jr. responded an hour-and-a-half later. “It’s amazing what she can get away with.”

Ladies and gentlemen, we have collusion within the Trump family.",1510608523,t3_7cqez8,
ds21sl0,-1,0,0,ds21sl0,"Every trans person will be monitored to ensure they don't support Trump. Any kind of thinking outside of the Democrat Party should be treated as a cri-me against the State. We shall also ensure that trans people act in a way acceptable to the State, lest they deviate from our agenda.

It is for their own good, com-rade.",1514850841,t3_7ni5er,
dsnz5es,0,-1,-1,dsnz5es,"It is insane this shit is page 15 news.  Imagine Bush did this.  Imagine Obama.  Holy Jesus, America.",1515941347,t3_7qc4uk,
dbzgbcs,-1,0,0,dbzgbcs,"You can't be an intellect and think inhaling the smoke of a burning plant won't have serious side effects. It's funny how the left is the one rejecting science on this issue, much to their own detriment. Democrats have become a party of vacuous morons.",1483532890,t3_5lyj5z,
dh5bpub,-1,0,1,dh5bpub,"I voted for Trump and am quite smart.  I get it you don't like him.  I get it that your party no longer has the bully pulpit nor controls any branches of gov't, and it's frustrating.  Do you really believe your salty intolerant comments will win people over to your side?  Thank you for 2020!",1493946661,t3_69bkxl,
dhmptjj,0,0,-1,dhmptjj,"History repeats itself.  This is the phrase that puts me at ease during these troubling times.

Trump is making the *exact* same mistakes Nixon did.

* Firing an investigator

* Taping conversations

* Symptoms of unusually extreme paranoia

*  When a president does it, its not illegal

So many parallels lead me to believe this crisis will end in exactly the same way.

Here's to hope.",1494947125,t3_6bhuo9,Texas
dhouuzt,0,-1,-1,dhouuzt,"This is not how our system is supposed to work! Republicans should be outraged at this.. If Clinton had won and Chelsea was leading a meeting, FoxNews would be heard around the world right now. 

This is not okay. This is not how a democracy works, the Trump family is not America's royal family.",1495051510,t3_6br6w9,
doi4ahk,-1,1,0,doi4ahk,Obama made no phone call. Kelly has confirmed.  Kelly did attend a breakfast for ALL gold star families 6 months later. Obama is scum. Stop with the media spin.,1508267628,t3_770h1f,
dr9qler,-1,0,0,dr9qler,"Trump turned down an invitation with Putin. End of story. For fucks sake, I'm a Democrat and I've come to terms that there's nothing there. You should do the same, because you're just making our party look pathetic.",1513304133,t3_7jwl6n,
dayj4m3,-1,0,0,dayj4m3,"CA is just another state where the urban liberals outnumber the entire rest of the state, and have no clue about the real world outside the city limits.",1481235011,t3_5h9k7e,
dhg6zgh,-1,1,1,dhg6zgh,"Nice try cnn fake news. A top dem did NOT say trump interfered with the russia probe.

Did NOT say that.

Edit: wow minus 80 karma in an hour. Does anyone come to r/politics to discuss? Seems like you guys just like to see the arrow light up...anyway, the guy said \"he thinks he did\". thats not the same as saying \"he did\". Sad that so many people cant grasp the difference.",1494555176,t3_6aoldp,
dhzlb2s,-99,-1,0,dhzlb2s,"i have a hard time believing that if a democratic president did this, a republican congress wouldn't impeach him/her

this is the national security threat that republicans are always wailing about. except this one is real. and with our national security at risk, they back the person who is the risk. republicans do not care about this country.",1495648804,t3_6d3op0,
dkonyiv,0,1,0,dkonyiv,"Do you have any proof that Bill O'Reilly is racist, because if you don't, then you shouldn't throw slanderous insults around.

Trayvon Martin was a thug who fit most of the demographic patterns of criminality. Jared Kushner is a well-educated, well-spoken young man with respectable upbringing. The facts here really aren't in dispute; You seem to just hate Republicans.",1500962890,t3_6pdzim,
dlceidj,0,-1,-1,dlceidj,Everyone better hope and pray Trump's Generals gain control of this situation. This dumb fuck could cost South Korea millions of lives.,1502220624,t3_6sfvwj,
dmfxc4y,0,-1,-1,dmfxc4y,"At this point, there are really only 2 explanations for remaining a Trump supporter: Malice towards others and willful ignorance. Neither are characteristics deserving of much respect, nor policy positions worth of debate.",1504299967,t3_6xhcz4,Wisconsin
do4p6tx,-1,0,0,do4p6tx,"*Oy vey*. More wolf who cried Nazi eh? That's just gonna make people laugh when there are real Nazi's lol. I've seen people call Jews \"Nazi \"just because they're conservative, so the word Nazi literally means Jack shit to me anymore.  

One of your subs just got their account banned for harassing me and sending me irl threats(Civil discussion). Nice job, guys 😤👍.",1507571584,t3_75aggr,
doz2757,0,0,-1,doz2757,"So literally everything the Trump team has said about this meeting has either been a half truth or a flat out lie. 

And we keep giving them the benefit of the doubt because why?",1509124108,t3_794iez,
dpae989,0,-1,-1,dpae989,"Mr Trump has previously said he regrets using the term. In an interview with Fox News in June 2016, he said: “I do regret calling her Pocahontas, because I think it’s a tremendous insult to Pocahontas.

\"So to Pocahontas, I would like to apologise.\"

The man is a complete asshole.",1509717758,t3_7aiyyp,
dpifgc9,0,0,-1,dpifgc9,"I'm not a trump supporter and I agree that his only qualification seems to be that his girlfriend was killed by a guy and none of the gun control he will propose will or would have changed that.

Being a victim doesn't make you an expert on anything.",1510118433,t3_7bie5e,
drtsa8p,-1,1,0,drtsa8p,"That the left would surely lose because you know, the red states have guns and your states banned them.

So how exactly is that a winning proposition for democrats?",1514399257,t3_7mfvu9,
ds8k6ni,0,-1,0,ds8k6ni,"GOP in full blown authoritarian mode.  here they are folks, the Domestic Enemies the founding fathers warned us of!  this is not a drill.",1515177064,t3_7od5t8,America
dsff1oq,0,-1,0,dsff1oq,"It's not classified, so it's not \"illegal\" but it might be against Senate procedures. Feinstein used a play right out of the Republican playbook and just tossed their kind of handshake agreements out the window.",1515522911,t3_7p8ynv,
du0kmlt,0,-1,-1,du0kmlt,I knew it. There was no way that Trump would allow this to happen. Now we just got to wait for another Pentagon Papers event to happen. I'm putting money on the Washington Post and New York Times as the two places that will get this leaked to.,1518226589,t3_7wical,South Dakota
dut9w29,-1,0,0,dut9w29,"\"SUuuurrrrRRRee\" *nods head sarcastically*

...Folks are circling the toilet with this dossier, its a matter of time until Clinton herself plops into the bowl like the turd that she is.",1519583580,t3_806bbx,
duvrtiv,0,-1,-1,duvrtiv,"&gt;
Trump pleads for recusal from the question, though, not because the question itself is wrong to ask. She pleads for recusal because she thinks it’s wrong for the press to ask a *daughter*  such a question after her father has issued his denials. Do daughters of presidents who are also assistants to the president really get to wave such a flag of privilege? No way.",1519693392,t3_80i97t,
d9h0seq,-1,0,1,d9h0seq,She's going to get fucking destroyed by the FBI. Nothing Trump could say is nearly as bad as what she has done.,1478018990,t3_5ak4y9,
da71z9h,0,0,-1,da71z9h,The Trump presidency: where advocating sexual assault is locker room talk and giving a peaceful speech at the end of a play is harassment.,1479572508,t3_5dt10m,
dktx4bw,0,1,0,dktx4bw,"Three Republicans voted country over party, and they saved my mother's life in the process.

Senators John McCain, Susan Collins, and Lisa Murkowski voted \"No\" and the bill that would effectively strip 15 million people of health care and raise premiums for the remaining insured by an average of 20% every year for the next decade failed by a tally of 49-51.

And my mother kept her health insurance. And I openly wept with joy.",1501221464,t3_6q1sl0,
