Input_id,labeldem,labelgop,labeldjt,id,body,created_utc,link_id,author_flair_text
dcslqe6,1,0,0,dcslqe6,"You really should have voting registration at those rallies.  The 2018 midterms are literally right around the corner and these drives and get out the vote need to start happening now.  A message to you there democratic leadership.

Edit:  Thanks for the gold but if anyone else gets the urge to give the gift of gilding, please consider donating to a charity or progressive movement instead.",1485177039,t3_5pntdh,
dfkl9jh,-1,1,1,dfkl9jh,who are the traitors? those who stand with a legitimate president or those who are trying to organize a coup d'etat with the media &amp; deep state's help? too sensitive trump is going after your pizza loving friends? democrat losers so delusional they think they can't lose an election and start blaming it on russia. now they're afraid ICE is going to help Trump deport their voter base.,1490814384,t3_6282va,
dib2dwu,-1,0,0,dib2dwu,"Crafting laws explicitly targeted at removing a political opponent from the ballots is a shameful attack on the democratic process, and not a victory for anyone.

Is this really what the democratic party stands for? \"We don't agree with the results of democracy, so we'll try to subvert it to get our way\".",1496297900,t3_6eksdd,
dl3ta5m,0,0,-1,dl3ta5m,"And this is news, and people should care, trump is going to spend 1m dollars housing people in his own properties that he gets to pocket out of taxpayer money. He is stealing your money. 

Edit: part of the expense is taking the mobile command station with him, which mean he can do anything there he could at the whitehouse. Also it's probably closer to 1m a day.",1501762542,t3_6rblg6,
dnqe2lg,-1,0,0,dnqe2lg,"Trigger warning: I was sent by Pootin to fuck up your mood.

I thought it was hillary's turn to be 45?

If the demos concentrated their power on economic issues, the one percent would have to give up too much.",1506809611,t3_73h686,
dpgnvvj,0,0,1,dpgnvvj,It's almost like Trump isn't a fascist and let's people do what they want....but it is fascist of me to speak about Trump in any positive manner,1510032928,t3_7bajc4,
drme3i8,-1,0,1,drme3i8,He has the economy rolling AND defeated ISIS.  We should do like we did with Obama and let a foreigner become president.,1513958140,t3_7li8av,
dsji3lb,0,-1,-1,dsji3lb,"Not to mention he's basically implying that Norway is a great country...but Norway has basically the complete opposite governmental (economic and social) policies to the Republican party. You know those same policies that the Republicans like to claim \"would totally destroy this country\". How ironic.",1515708374,t3_7prjm4,
devrxsu,0,0,-1,devrxsu,"As Zachary Wolf so eloquently put it: 

&gt; Yes. I mean, this is what makes covering Donald Trump so very difficult. What does he mean when he says words?",1489433323,t3_5z738k,
dgeluxj,1,-1,-1,dgeluxj,"\"Look, Trump may be a sexual predator who wants to sleep with his daughter, who is a symbol of everything the Bible preaches against; gluttony, greed, lust, and he may have been compromised by the Russians and acted treasonously to gain the office...but at least he's not a Democrat\"

-Average GOP voter.",1492484943,t3_660ac9,Texas
dhypflh,0,-1,-1,dhypflh,"If Soros ends up being a part of what implicates Kush in a crime, trumpists' heads won't just explode, they'd evaporate instantly",1495599990,t3_6czxdh,
diq33li,-1,0,0,diq33li,"You misspelled \"President of the United States\".

Didn't Hillary have \"anybody\" on her team that understood how we elect our president?  Anybody?

\"Elections have consequences\".
\"We won\".
\"Win some elections\".
\"We need to reward our friends and punish our enemies\".
~  Barackkk H. Obama",1497117078,t3_6gfrcm,
dizbtje,0,-1,-1,dizbtje,"&gt;...Andrew Weissmann, who led the Enron investigation.

Mueller is hiring on a giant-slayer.  Read that any way you like, but it's not good for the Trump administration.",1497616143,t3_6hm0bz,
dkow43h,1,-1,-1,dkow43h,"&gt;\"By the way, just a question: did President Obama ever come to a Jamboree?\" Mr Trump asks. The audience shouts \"No!\". Mr Obama did address the Jamboree by video link in 2010. He was also a former boy scout, unlike Mr Trump.

Trump is such a clown.",1500983067,t3_6pfgfv,
dqfnjq2,0,-1,0,dqfnjq2,"Hey can you imagine the investigations that Republicans and Fox would be calling for if President Obama was involved in something like this even tangentially? 

Hahaha.. ha.. *crying now*",1511833197,t3_7fzs7i,
drmy3li,0,-1,-1,drmy3li,"&gt; The 13 arrows representing the original 13 colonies have been removed, and Trump's name appears three times on the coin, which is much thicker than its predecessors. And as one White House aide told The Post, the coin is \"very gold,\" adding that Trump \"wanted to weigh in on\" its design.

What an egotistical piece of shit.",1513980927,t3_7lkmm5,Nevada
drnxbju,-1,1,1,drnxbju,"\"I hate politics. I don't want to hear anything about it, I just watch Fox News so I know what other people are talking about. Of course I voted Republican, don't you know how Evil Hillary is? The whole Democratic party has no morals, they are baby killers, why wouldn't I support our president!?\"",1514046213,t3_7lpcpe,California
da7eiun,-1,1,0,da7eiun,"Bush refused to criticize or undermine Obama and the \"Presidency\" but Obama does not feel he should return that favor in kind.  Even after Obama laid waste to Bush and blamed him for everything for 8 years.  

Ah well.  If Obama wants to pick a fight with a sitting President, that's on him.  He lacks power in that exchange.",1479591333,t3_5du9t2,
dd3zj6c,-1,0,0,dd3zj6c,"&gt; it's fucking prophetic

No, it's fucking pathetic. Bernie needs to give back the money that Hillary paid him off with, and the left needs to quit making Alex Jones look like CNN with their crazy conspiracy theories.",1485804812,t3_5r1zzc,
ddhz9b3,0,0,-1,ddhz9b3,"A \"direct attack\" on the prez, despite Ivanka having supposedly divested herself of the business. The only connection left, we're told, is her name.

So how is a retailer discontinuing Ivanka's (divested) name-brand products a \"direct\" attack, while Trump somehow claims not to have any \"direct\" connection to his (not divested) name-brand hotels?",1486582408,t3_5suweo,
dei1qgi,0,-1,-1,dei1qgi,"Incredibly stupid of Trump to even suggest this.

Either he's repeating pure bullshit from Breitbart or it has a nugget of truth and a judge was shown evidence sufficient to authorise a tap.

Neither plays well for the Whitehouse.",1488640912,t3_5xhbvm,
dtfne7p,-1,0,1,dtfne7p,"#CAN'T STUMP THE TRUMP

NO impeachment

NO indictment

NO wrongdoing

NO collusion

FULL RESPECT of women

ECONOMY BEST IT'S EVER BEEN

WALL GOES UP, LIBERAL PANTIES GO DOWN

TWO WHOLE TERMS, TWO BIG HANDS

[[points at you]] WHO'S THAT? It's you! ANGRY LEFTOID KEYBOARD SMASHER and WANNABE STUMPER! guess what pumpkin. UNSTUMPABLE. ELECTION NIGHT TEARS REPEATING. SEEK comfort in SNL because the FAKE NEWS TV box is the ONLY PLACE your reality is accepted!",1517264637,t3_7tu63m,
da6yqau,1,-99,-99,da6yqau,"Remember when Obama demanded apologies from the people who burned him in effigy or lied about him being born in Kenya, was a secret Muslim etc etc. Oh right, you can't remember that because he acted like an adult and did not do that.",1479566397,t3_5dsn3i,
damcpr1,0,-1,-1,damcpr1,"Put your money where your mouth is, Mr. President.  Do something bold so the republicans have to be the bad guys they are and make it illegal again.",1480530075,t3_5fr5a2,
dd17w6t,0,0,-1,dd17w6t,"netflix should make a comedy show about the trump fam in the white house and hire Alec Baldwin to play the Donald. 

imagine all the butt hurt tweets Trump would make after watching each episode",1485642871,t3_5qqa94,
dhcks2u,0,0,-1,dhcks2u,That's the Federal Bureau of Hornets' Nests to you. There's two things FBI agents don't like: stairs and surprises. Trump just pushed Comey down a flight of stairs with no warning and said it was because reasons.,1494368649,t3_6a8jsf,
dirih7y,-1,0,0,dirih7y,Why would it? It was a total nothingburger. It was hyped to shit and he ended up doing more damage to the narrative the Democrats were trying to create than to Trump himself. He came out unscathed.,1497207553,t3_6gmngv,
dq3jmgs,0,-1,-1,dq3jmgs,I'm sure Trump's intelligence is mocked in private by a lot of people. It's hard to hide being a fucking moron from your coworkers when you're a fucking moron. It's part of being a fucking moron.,1511198149,t3_7eacsa,
dsz6i49,-1,0,0,dsz6i49,"&gt; Let his victims speak.

LOL. I bet you liberals don't even realize the irony here. This sort of documentary is the exact thing that was legalized with Citizens United. And yet liberals can't stop whining about that legal ruling.",1516474737,t3_7rr4dw,
dtgixol,-1,0,0,dtgixol,"Honeslty, we need to ban democrats from ever holding political power. If people like Chuck Schumer and Adam Schiff are willing to blatantly lie to the American people, with no regret, we have a serious issue. 

Hopefully this memo marks the beginning of the end for these traitors.",1517309231,t3_7twu5s,
du3aawr,-1,0,0,du3aawr,"What is all this nonsense?  Liberals all of a sudden against globalism or something?  Selling property to Russia isn't illegal or even suspicious (unless that property is Uranium or something).",1518375557,t3_7wsvme,
du3ewwo,-1,0,0,du3ewwo,"Hillary was guilty though. She had the server.  She sent the classified emails. 

These were not mere allegations. They were objectively true facts. She broke the law.

Trump may not rush to judgment, but even he could not deny the overwhelming evidence of hillary's crimes and misdeeds.",1518380689,t3_7wv4vr,
du4kdm8,-1,1,0,du4kdm8,"There has been no evidence of Russian collusion; in fact, in light of all that’s being exposed about the fbi, they are the ones trying to pay Russian agents for dirt on trump and there is actual evidence lol you guys simply live in some alternate reality at this point",1518443463,t3_7wztdu,
dc2u9wt,0,0,-1,dc2u9wt,"President Elect Donald Trump is arguing with the Terminator over the ratings of the reality show the President (elect) hosted in the past on twitter. 

Our country is so fucked.",1483717344,t3_5me4ze,Pennsylvania
dedm5ic,0,-1,-1,dedm5ic,"Who is indy100.com? Can anyone cross reference this? I hate Trump as much as the next guy, but I also hate clickbait and hyperbole.",1488393196,t3_5wwg5t,New York
dglnnv7,0,-1,-1,dglnnv7,"Every god damn thing these republicans accuse democrats of is a massive erectile projection of themselves. How the fuck do they live with themselves? I am not sure if I have empathy, sympathy, disgust, revulsion or a combination there of, towards you if you are a republican.",1492867353,t3_66vwiv,
dm4y38b,0,0,1,dm4y38b,"Good on Trump. This guy was fired purely for political reasons while doing his job. All's well that ends well

Edit: Thanks for the gold fellow sane person. Much appreciated",1503712884,t3_6w2hq4,
dpqlve7,-1,0,0,dpqlve7,Russia is not an enemy of the United States. We're not going to make up fake enemies just because Hillary Clinton lost an election. That's silly and immature. Honestly all this blame and fear of Russians sounds awfully similar to how Germans felt towards Jews before WW2.,1510544825,t3_7cj6vs,
dps3ree,0,-1,0,dps3ree,"This has to be the nail in the coffin of the \"democrat conspiracy\" narrative. Democrats did not travel back in time 40 years to ban him from a shopping mall so that one day they'd have dirt on him.

The allegations just took on a tremendous amount of credibility, they should not even be in question now.

If the republicans still defend Moore they are officially defending a pedophile.",1510618461,t3_7crjpz,
ds5pq0g,0,1,1,ds5pq0g,"A lib I know filed an foia request that he was sure would bring down the “fascist Trump regime”.

What did the reply reveal? That Trump is working hard af to make America great again. My friend is a maga dude now. 😌",1515031582,t3_7nyuqq,
dtmdi4r,0,0,-1,dtmdi4r,"Ever since the FBI reopened the investigation into Trump's e-mail server on the eve of the election and handed the presidency to Hillary I knew the FBI was conspiring against trump.


Wait...",1517572503,t3_7uqsof,New Jersey
d9sw5bj,1,0,-1,d9sw5bj,"We have always needed to support fearless, independent journalism.  Not just now that someone we dont like was elected to be president.

Fearless, independent journalism would have given us a Bernie Sanders democratic nominee instead of a Clinton.",1478704419,t3_5c1ll8,
dcuyn73,0,-1,-1,dcuyn73,"&gt; Badlands National Park posted several facts about climate change on its official Twitter account Tuesday afternoon, sharing statistics that might contradict the beliefs of President Donald Trump's new administration.

&gt; \"Today, the amount of carbon dioxide in the atmosphere is higher than at any time in the last 650,000 years. #climate,\" the park tweeted on Tuesday.

Parks and Rekt

(But seriously, good on 'em. Let the facts speak for themselves.)",1485295161,t3_5pz2m8,
dd4pqpy,-1,0,1,dd4pqpy,"The best part of being a Trump supporter is the constant **WINNING**

Poor liberals are constantly crying. Very sad. I hope they get better soon

Edit: Record downvotes in here. 33 in less than a minute

Edit 2: 68 in 2 minutes. Keep it coming, your tears make me sleep well.",1485836122,t3_5r5hkm,Foreign
de0tqxt,-99,-1,1,de0tqxt,"\"Protesters Ready for Trump’s First Visit\"

in other words jobless losers wait for the next chance to claim victim and blame someone else.

edit: tea party? fuck the tea party. idgaf abt them",1487691258,t3_5vbi24,
dfk6j7p,-1,0,0,dfk6j7p,"Holy fucking shit. Is the media literally advising the democrats on how to proceed? 

Bias much?  

Edit: come on boys! Downvote me harder! I love it!",1490798875,t3_626z7v,
dh29y4z,-1,0,0,dh29y4z,Yes Trump is immune from all federal law. Russia isn't an enemy of the United States. What would treason look like? How about sending a billion dollars to the Islamic Republic of Iran or trading high 5 ranking Taliban members for a deserter.,1493786324,t3_68xa5d,
djyjqyg,-1,1,0,djyjqyg,"Apples and oranges.  Chelsea clinton has literally done nothing with her life but take handouts because of her last name, and shes quite obviously \"not the sharpest tool in the shed\".  
Ivanka on the other hand has run successful companies and is smart, articulate, and a great representative of the United States.  It's tough to compare the two.",1499546055,t3_6m22pn,
dnurz90,0,0,-1,dnurz90,"&gt;President Trump told Puerto Rico officials they should feel proud that hadn’t lost thousands of lives like in *“a real catastrophe like Katrina,”* and also said the devastated island territory was throwing the nation’s budget *“a little out of whack”* during his first visit there since Hurricane Maria ravaged the island nearly two weeks ago. 

Everytime he opens his hole a sewer of the most ignorant, despicable, vile thoughts come flooding out.",1507050071,t3_741kwn,
doiocmv,0,0,-1,doiocmv,"OK, Trump, I'm sorry I ever criticized you for being slow to talk with these families. It'd be better if you never reached out at all.",1508289070,t3_7732t3,
dq7reme,0,-1,-1,dq7reme,"Google, Facebook, Twitter, etc....

Time to blackout your pages.

Plus, imagine if Trump couldn't tweet for a week! He might actually do something positive about NN",1511397588,t3_7evicd,
dt6uksa,-1,0,1,dt6uksa,"All of which is not the case here. If he really were such a dictator, then things like the Mueller investigation and mainstream media scrutiny would not exist. People calling Trump a dictator seem to have more problems with democracy than with Trump.",1516833353,t3_7sqnsd,
dbhbmha,-1,0,0,dbhbmha,"Non-story. She won't run again. And even if she does, she won't get the nomination after losing to Trump the first time around.",1482356970,t3_5jmfb7,
dcgfrou,-1,0,1,dcgfrou,"Whites are not superior, but if you treat us like shit, you get president trump.  Very few of the marchers bothered to actually vote in the election",1484490413,t3_5o3i4q,
depde48,0,-1,0,depde48,"&gt; Republicans basically support the complete opposite of every expert in the related field.

It's anti-intellectualism run rampant. Experts are not to be trusted over the reactionary uninformed opinions of the ignorant.",1489061334,t3_5yekfr,
dj0gaxl,-1,0,0,dj0gaxl,"Trump does business with a major bank, and that implicates him somehow? Your conspiracy theory is baseless. Liberals at Starbucks sipping on their Frappucinno Coolatas are furiously typing away on their imac laptops about whatever new conspiracy theory the NYT or the WP come up with. And it seems like you are one of them, my friend.",1497665404,t3_6hqhtz,
dl28lxl,0,0,-1,dl28lxl,I'll be honest: I did not see this coming. The idea of Trump having a direct hand in the Seth Rich rumors wouldn't have even occurred to me.,1501685327,t3_6r4g0e,
dq1jk0u,0,1,1,dq1jk0u,"You have it all wrong we love Trump because he is going after Pedophiles to arrest them. If you look the arrests from last year to this year is a significant increase of pedo cases involved.  Multple child traffic rings. If you remember that whole \"pedogate\" movement late last year, that intent was to push to find and arrest them. This was pushed by the right wing narrative.",1511094959,t3_7dz64a,
dqehuym,0,0,-1,dqehuym,I misread the title as “Trump ethics lawyer exists” and was like “I can see how that would be news to most people”.,1511786222,t3_7fur7s,Missouri
drjh9dm,-1,1,0,drjh9dm,Democrats are so desperate for Republicans to fire Mueller that I wouldn't be surprised if the dems fire him and say it was the republicans.,1513806446,t3_7l4hri,
drw9cql,0,1,1,drw9cql,"‘Reportedly’

Fake news.

And our president had no trouble at all understanding Merkel. She just doesn’t understand that Trump presents a new paradigm, one that is bereft of the old politically correct Globalism. It’s a big reason why he got elected and why he continues to enjoy the support of the American people.",1514522048,t3_7mrufo,
dsjgl59,0,0,-1,dsjgl59,"Any other president, any other politician, and this scandal would last months and possibly take down their career. With Trump, I fear this story will be old news by week's end.",1515706928,t3_7prjm4,
du1z7w4,-1,0,0,du1z7w4,"using this dudes sick kid for political gains and sympathy, stay classy democrats!

maybe when he gets kicked out he will try and illegally enter for the 3rd time",1518302365,t3_7wofus,
dupe9v4,0,0,-1,dupe9v4,"Unfortunately, he is showing absolutely no sign of brain activity. At this point he is just a sack of burnt meat. 

The kind of thing Trump would put ketchup on.",1519393240,t3_7znzn1,
dd21mhk,0,1,1,dd21mhk,"Trump consulted lawyers to make sure his policies followed all US laws?  Oh my god, so evil - literally Hitler confirmed!!!",1485699156,t3_5qtpow,
dilfbp0,-1,1,1,dilfbp0,"At a certain point, I knew I'd start feeling bad for liberals. This is that time. Comey confirmed to Trump that he's not under investigation, he said he didn't consider the Flynn thing obstruction, and the Russia nonsense was based on unverified reports. 

LMAOOOOOOOOOOOOOOOOO",1496866860,t3_6fv8bi,
dl3sbvp,0,-1,-1,dl3sbvp,"To anyone who is thinking \"this isn't news; no one cares,\" I want to draw attention to the fact that far fewer people would care about Trump's golfing *if he hadn't repeatedly chastised Obama for golfing over the last eight years*.

The problem isn't his hobby--it's his hypocrisy. After endlessly berating Obama for playing golf, Trump has played *far more often*.

Hypocrisy. Trump is a hypocrite. That's what we're mad about.",1501760803,t3_6rblg6,
dmzmu6v,0,0,-1,dmzmu6v,"So trump tweets no deal but then caves on the wall and takes the Democratic side on Dreamers?

I'm so confused",1505388069,t3_701bws,
do822ws,-1,0,0,do822ws,"What a mess, lol -- looks like he's back on the pills again. 

It's telling that liberals are so quick to rally around him, though, considering all his harmful misogynistic, anti-gay lyrics. What am I saying, they enabled Harvey Weinstein for 30 years...",1507739602,t3_75q5dz,
dq4hcmp,-1,-99,-99,dq4hcmp,"Title claim:

&gt; Eric Trump funneled cancer charity money to his business

Reality:

&gt; Forbes **alleges** Eric Trump funneled cancer charity money to his business

Quick, downvote my comment before the 10% of people browsing this sub that aren't Shareblue see it.",1511234330,t3_7eebwe,
dsfpdv2,0,-1,-1,dsfpdv2,"The guy the alt-right claimed to be a political mastermind was fired, got a Democrat elected in Alabama and then got fired again. Just another far-right stable genius!",1515533028,t3_7paaf5,
dckzvwc,0,0,-1,dckzvwc,"It's scary, Trump is painting every news piece that goes against his narrative as fake news. You know who else does this? Dictators. If you delegitimize all the media other than \"state sponsored\" sources, you control the flow of information. This isn't just a \"shake your head and sigh\" thing, this is the first step to a dictatorship.",1484747360,t3_5opf7m,
dd5s2sw,-1,0,0,dd5s2sw,"No Donald Trump even has left-wing redditors screaming states rights.

Further proof that nobody on Reddit has any real conviction they are just pawns in the political tribalism game",1485896482,t3_5rawkx,
ddc4fn2,0,-1,-1,ddc4fn2,Everyone refer to president Bannon. Trump will hate it so much he will fire him. Then Bannon will likely dump the dirt. Then we will see both in massive lawsuits.,1486246336,t3_5s34nk,
dfaaytm,1,-1,-1,dfaaytm,"&gt; The FBI has information that indicates associates of President Donald Trump communicated with suspected Russian operatives to possibly coordinate the release of information damaging to Hillary Clinton's campaign, US officials told CNN.

Robbed. The largest and most important executive position in the world... robbed. Those bastards.

Trump sold the US to the highest fucking bidder.",1490227745,t3_60yh2f,Missouri
dfxk9qh,0,-1,-1,dfxk9qh,"I think we've nailed it. Trump set up an elaborate scheme to lose billions of dollars in the 90's, slowly building his real estate empire until he was ready to win the presidency to take hotel room rental bribes. LMAO he is just too stupid to set up a Foundation and give speeches for a half hour...",1491521022,t3_63w5td,
dhtvp4b,-1,0,0,dhtvp4b,"Nancy Pelosi is a rich white center / right liberal who is nothing but a safety valve for corporate capitalism.

The purpose of people like her and Chuck Schumer is to prevent any form of even moderately progressive legislation passing through the House and Senate, while posturing just barely left of the Republican Party to maintain a good PR campaign",1495328602,t3_6cduup,
djkrxrg,0,-1,0,djkrxrg,"\"In the midst of the 2016 campaign, a veteran GOP opposition researcher who said he had ties to ousted national security adviser Michael Flynn contacted hackers hoping to obtain emails that he believed Russian operatives had hacked from Hillary Clinton’s personal server, the Wall Street Journal reported Thursday.\"

And that is collusion.",1498772366,t3_6kbk9u,
dr0y2ph,-1,1,1,dr0y2ph,"Put simpler, liberals are spending daddy's money on a fancy degree based on a philosophy of \"hand outs\" while conservatives are earning their own way through live based on a philosophy of \"personal responsibility.\"",1512880427,t3_7iqo3h,
dr4zopr,-1,1,1,dr4zopr,It was not sexualy suggestive. The only sexual suggestive thing said was when Gillibrand falsely accused trump of sexual misconduct. I have a feeling that the fake news msm will spin this tweet to make it sexual but that is why they are known for fake news.,1513092410,t3_7jbeb7,
drhg5sj,0,1,1,drhg5sj,"I would donate money so my kids could have the privilege of meeting Ivanka Trump, shes magnificent. It really is pleasant to see such a gorgeous family representing our nation for a change. I mean just look at Melania and her pictures as first lady, absolutely beautiful. And shes intelligent. I feel honored to have an immigrant as first lady to represent that America is truly a nation of immigrants.",1513710837,t3_7kvedj,
dsf4nbc,-1,0,0,dsf4nbc,"Followed by a rendition of the famous George Takei shutdown:

&gt;*The problem isn't that Nazis are bad, it's that liberals call everyone they don't agree with a Nazi*\" 🎶",1515512628,t3_7p7hsx,
dt71lz0,0,0,-1,dt71lz0,"&gt;President Trump on Jan. 24 suggested that he was being investigated for obstruction of justice for his decision to “fight back” against the Russia probe.

Congrats Mr. President, you finally learned what the law 'obstruction of justice' means.",1516840965,t3_7sryew,
duta1ap,-1,1,1,duta1ap,Trump should just ignore Mueller and MAGA on.  Let him find another troll farm to indict.  The Trump Russia collusion hoax is a dud.,1519583741,t3_806bcc,
dep09sn,-1,0,-1,dep09sn,"But that was always his plan for everything.

Take all the credit for everything that goes well, even things caused by Obama (e.g. the current increase in jobs), blame everything that goes wrong on Obama (or immigrants, or liberals, or muslims, or anyone else except himself)",1489031282,t3_5ycszd,
detwbup,1,-1,-1,detwbup,"I'm still waiting for an explanation on how this makes us safer, given that the countries listed haven't attacked us.  Meanwhile Trump reversed an Obama order paving the way for us to sell arms to the Saudi's, who did attack us on 9/11",1489326599,t3_5yykat,
deyktel,0,-1,-1,deyktel,"Ahh look at these personally responsible Republicans trying to pass the buck on this shit heap. 

WH: \"Don't call it Trumpcare\"

Ryan: \"Trump helped write it\"",1489588495,t3_5zjodb,
dimsmto,-1,0,0,dimsmto,"Clinton destroyed emails after subpoena

Comey mishandled the whole criminal investigation into her email scandal

Comey deserved to be fired for that; those issues are very relevant here",1496939274,t3_6g0srl,
